,datetime,title,tag,url
126,2023-10-14,Adam Zivo: Russia shows itself to be no friend of Israel,NP Comment,https://nationalpost.com/opinion/adam-zivo-russia-shows-itself-to-be-no-friend-of-israel
127,2023-10-14,Israel-Hamas War Day 8: Some of the first Canadians to escape the war land in Toronto,News,https://nationalpost.com/news/israel-hamas-war-day-8
128,2023-10-14,Students for Justice in Palestine chapters distribute activist toolkit: 'Confrontation by any means necessary',News,https://nationalpost.com/news/hamas-support-students-justice-in-palestine
129,2023-10-14,Netanyahu's statement on Shabbat is the first time an Israeli premier addressed the nation on Jewish day of rest,News,https://nationalpost.com/news/netanyahu-shabbat-statement
130,2023-10-15,NDP members vote to withdraw from Liberal deal if government doesn't pass pharmacare bill,Canadian Politics,https://nationalpost.com/news/politics/ndp-liberal-deal-pharmacare
131,2023-10-15,Documents found on dead Hamas terrorists reveal plan to target children: reports,Israel & Middle East,https://nationalpost.com/news/world/israel-middle-east/hamas-children-israel
132,2023-10-15,Five Canadians were killed in Israel. Here's what we know about them,Canada,https://nationalpost.com/news/canada/canadians-killed-in-israel
133,2023-10-15,Letters: Hamas supporters 'have no rightful place in our society',NP Comment,https://nationalpost.com/opinion/letters-hamas-supporters-have-no-rightful-place-in-our-society
134,2023-10-15,"Raymond J. de Souza: If history is a guide, Hamas' gamble will likely backfire",NP Comment,https://nationalpost.com/opinion/if-history-is-a-guide-hamas-gamble-will-likely-backfire
135,2023-10-15,NP View: Canada must help bring Hamas down,NP Comment,https://nationalpost.com/opinion/canada-must-help-bring-hamas-down
136,2023-10-15,Russian governor who said there's 'no need' for war in Ukraine reported to police,World,https://nationalpost.com/news/world/russian-governor-who-said-theres-no-need-for-war-in-ukraine-reported-to-police
137,2023-10-15,Weekend Posted: Some great stories you may have missed,News,https://nationalpost.com/news/weekend-posted-some-great-stories-you-may-have-missed-15
138,2023-10-15,Israel-Hamas War Day 9: Cross-border attacks intensify between Israel and Hezbollah in Lebanon,Israel & Middle East,https://nationalpost.com/news/world/israel-middle-east/israel-hamas-war-day-9
139,2023-10-15,U.S. in frantic bid to avert wider Israel war as Iran warns conflict 'could spiral out of control',Israel & Middle East,https://nationalpost.com/news/world/israel-middle-east/us-warned-iran-israel-hamas-war
140,2023-10-15,Stanford suspends instructor who allegedly called out Jewish students over Israel-Hamas war,World,https://nationalpost.com/news/world/stanford-instructor-suspended-jewish-students-holocaust
141,2023-10-16,Italian lawmakers debate long-delayed Holocaust Museum revived by far-right-led government,PMN News,https://nationalpost.com/pmn/news-pmn/italian-lawmakers-debate-long-delayed-holocaust-museum-revived-by-far-right-led-government
142,2023-10-16,Chris Selley: Quebec's war on English-language universities is pure civic vandalism,NP Comment,https://nationalpost.com/opinion/selley-quebec-war-on-english-language-universities
143,2023-10-16,Soccer match between Belgium and Sweden suspended after a gunman kills 2 Swedes in Brussels,PMN News,https://nationalpost.com/pmn/news-pmn/soccer-match-between-belgium-and-sweden-suspended-after-gunman-kills-2-swedes-in-brussels
144,2023-10-16,"After horrific killings by Hamas, Israeli trauma over the Holocaust resurfaces",World,https://nationalpost.com/news/world/hamas-killings-israel-holocaust-trauma
145,2023-10-16,Trudeau says it's 'imperative' that supplies get through Israel's Gaza siege,News,https://nationalpost.com/news/trudeau-its-imperative-supplies-get-to-gaza
146,2023-10-16,Retired Canadian teacher believed to be among hostages taken by Hamas: daughter,Israel & Middle East,https://nationalpost.com/news/world/israel-middle-east/judith-weinstein-haggai-israel-hamas-attack
147,2023-10-16,Diane Francis: Hamas throws Middle East into turmoil,Financial Post,https://nationalpost.comhttps://financialpost.com/diane-francis/hamas-middle-east-turmoil
148,2023-10-16,Trump sues ex-British spy over leaked dossier of 'shocking and scandalous' allegations,World,https://nationalpost.com/news/world/trump-sues-ex-british-spy-over-leaked-dossier
149,2023-10-16,Toronto-area developers aim to raise $1 million for Israel,World,https://nationalpost.com/news/world/toronto-area-developers-aim-to-raise-1-million-for-israel
150,2023-10-16,Here's a list of key Hamas operatives killed by Israeli forces,News,https://nationalpost.com/news/heres-a-list-of-key-hamas-operatives-killed-by-israeli-forces
151,2023-10-16,Daniel Koren: York University needs to shut down its antisemitic hate mills now,NP Comment,https://nationalpost.com/opinion/york-university-needs-to-shut-down-its-antisemitic-hate-mills-now
152,2023-10-16,Hate crimes across Canada on the rise in wake of Israel-Hamas War,News,https://nationalpost.com/news/hate-crimes-canada-israel-hamas-war
153,2023-10-16,Canadian killed in Israel-Hamas war died trying to protect his girlfriend,Israel & Middle East,https://nationalpost.com/news/world/israel-middle-east/israel-hamas-canadian-killed
154,2023-10-16,Disturbing Hamas terror booklet on 'how to torture and kidnap' citizens,Israel & Middle East,https://nationalpost.com/news/world/israel-middle-east/hamas-booklet-hostages
155,2023-10-16,Fallen Israeli soldier saves five lives with organ donation,News,https://nationalpost.com/news/fallen-idf-soldier-saves-five-lives-with-organ-donation
156,2023-10-16,Obliterating Hamas in Gaza is Israel’s only option now: Full Comment podcast,NP Comment,https://nationalpost.com/opinion/obliterating-hamas-in-gaza-is-israels-only-option-now
157,2023-10-16,First group of Canadians safely cross from West Bank into neighbouring Jordan,News,https://nationalpost.com/news/first-group-of-canadians-rescued-west-bank-gaza
158,2023-10-16,‘Bring them back now’: Israeli families call for return of Hamas hostages,News,https://nationalpost.com/news/israeli-families-hamas-hostages-gaza
159,2023-10-16,FIRST READING: The pro-terror rot at the centre of Canadian academia,NP Comment,https://nationalpost.com/opinion/pro-terror-rot-at-the-centre-of-canadian-academia
160,2023-10-16,"Jamie Sarkonak: If there was ever a time to defund student revolutionaries, it's now",NP Comment,https://nationalpost.com/opinion/jamie-sarkonak-if-there-was-ever-a-time-to-defund-student-revolutionaries-its-now
161,2023-10-16,In the news today: Fifth Canadian dies in Israel after Hamas attacks,PMN Canada,https://nationalpost.com/pmn/news-pmn/canada-news-pmn/in-the-news-today-fifth-canadian-dies-in-israel-after-hamas-attacks
162,2023-10-17,"Failed Palestinian rocket caused deadly blast at Gaza hospital, Israel says",Israel & Middle East,https://nationalpost.com/news/world/israel-middle-east/failed-palestinian-rocket-caused-deadly-blast-at-gaza-hospital-israel-says
163,2023-10-17,Versailles Palace evacuated again for security alert amid high vigilance in France against attacks,News,https://nationalpost.com/news/versailles-palace-evacuated-again-for-security-alert-amid-high-vigilance-in-france-against-attacks
164,2023-10-17,Ottawa man departs Canada to join IDF fight against Hamas terrorists,Canada,https://nationalpost.com/news/canada/ottawa-man-join-idf-fight-hamas-terrorists
165,2023-10-17,"Israel-Hamas War updates: Hamas releases video of injured Israeli hostage, 21",Israel & Middle East,https://nationalpost.com/news/world/israel-middle-east/israel-hamas-war-day-10
166,2023-10-17,'Sleepless nights': Canadian's sons called up to fight for Israel on two fronts,Canada,https://nationalpost.com/news/local-news/sleepless-nights-calgary-natives-sons-called-up-to-fight-for-israel-on-two-fronts/wcm/d556093f-2077-4f8b-ad7a-c4ba88553b87
167,2023-10-17,"Canada's new antisemitism envoy eyes the 'cancerous hate speech' on campuses, social media",Canada,https://nationalpost.com/news/canada/canadas-new-antisemitism-envoy-eyes-the-cancerous-hate-speech-on-campuses-and-social-media
168,2023-10-17,"Two Swedes killed in suspected Brussels terror attack, prompting lockdown at Belgium-Sweden soccer match",World,https://nationalpost.com/news/world/two-swedes-killed-in-suspected-brussels-terror-attack-prompting-lockdown-at-belgium-sweden-soccer-match
169,2023-10-17,"In the news today: War update from Israel, Canadian grocers keep mum on pricing plans",PMN Canada,https://nationalpost.com/pmn/news-pmn/canada-news-pmn/in-the-news-today-canadian-grocers-keep-mum-on-pricing-plans-and-n-b-throne-speech
170,2023-10-17,Tories blocked from summoning CBC execs over network's refusal to label Hamas 'terrorists',News,https://nationalpost.com/news/tories-blocked-from-summoning-cbc-over-refusal-to-call-hamas-terrorists
171,2023-10-17,George Monastiriakos: Hamas has always been an impediment to peace,NP Comment,https://nationalpost.com/opinion/hamas-has-always-been-an-impediment-to-peace
172,2023-10-17,Israel-Hamas war updates: Arab countries demand Gaza ceasefire after hospital explosion,Israel & Middle East,https://nationalpost.com/news/world/israel-middle-east/israel-hamas-war-day-11
173,2023-10-17,"Governments got the COVID response right, most Canadians — outside the Prairies — feel",Canada,https://nationalpost.com/news/canada/most-canadians-agree-governments-covid-response
174,2023-10-17,Sixth Canadian killed in Israel-Hamas war is 23-year-old Tiferet Lapidot,Canada,https://nationalpost.com/news/canada/israeli-woman-with-canadian-relatives-has-died
175,2023-10-17,Mother of Israeli hostage in video pleads for safe return home: 'Bring my baby back',World,https://nationalpost.com/news/world/hamas-israel-hostage-mia-shem
176,2023-10-17,CBC issues lengthy explanation of why it won't call Hamas 'terrorists',News,https://nationalpost.com/news/cbc-hamas-terrorists
177,2023-10-17,"'Casualties everywhere': Canadian in Gaza describes chaos, hopes for evacuation",PMN Canada,https://nationalpost.com/pmn/news-pmn/canada-news-pmn/canadian-man-in-gaza-describes-chaotic-conditions-while-hoping-for-border-to-open
178,2023-10-17,Tasha Kheiriddin: NDP starting to lose faith in Singh and his unholy Liberal alliance,NP Comment,https://nationalpost.com/opinion/sing-in-a-bind-after-ndp-delegates-draw-red-line-on-pharmacare
179,2023-10-17,Warnings flashing red in oil markets amid Israel-Hamas conflict,Financial Post,https://nationalpost.comhttps://financialpost.com/news/oil-prices-could-spike-if-israel-hamas-war-spreads
180,2023-10-18,Workers noticed beam hanging off railcar days before fatal accident but didn't tell the railroad,PMN News,https://nationalpost.com/pmn/news-pmn/workers-noticed-beam-hanging-off-railcar-days-before-fatal-accident-but-didnt-tell-the-railroad
181,2023-10-18,French soccer club Nice suspends Youcef Atal for sharing an antisemitic message on social media,PMN News,https://nationalpost.com/pmn/news-pmn/french-soccer-club-nice-suspends-youcef-atal-for-sharing-an-antisemitic-message-on-social-media
182,2023-10-18,Ottawa rushes to condemn 'attack' on Gaza hospital despite the initial claims coming from Hamas,Canada,https://nationalpost.com/news/canada/ottawa-quickly-condemned-gaza-hospital-attack-as-hamas-claimed
183,2023-10-18,China's Xi gets endorsement for new world order in meeting with Russia's Putin,News,https://nationalpost.com/news/china-russia-xi-jinping-putin
184,2023-10-18,Conservatives decry Speaker's pitch for decorum that delayed question period,Canadian Politics,https://nationalpost.com/news/politics/new-speaker-decorum-in-house-of-commons
185,2023-10-18,Terry Glavin: The 'Palestinian problem' is not Israel's to solve alone,NP Comment,https://nationalpost.com/opinion/terry-glavin-the-palestinian-problem-is-not-israels-to-solve-alone
186,2023-10-18,Sabrina Maddeaux: Trudeau's dash to blame Israel for Gaza hospital explosion an embarrassment to Canada,NP Comment,https://nationalpost.com/opinion/trudeaus-rush-to-blame-israel-for-gaza-hospital-explosion-an-embarrassment-to-canada
187,2023-10-18,Red Deer trustee who compared Pride to Nazis said the Holy Spirit told her to do it,News,https://nationalpost.com/news/red-deer-trustee-who-compared-pride-to-nazis-said-the-holy-spirit-told-her-to-do-it
188,2023-10-18,"FIRST READING: Canadian-headed Muslim group condemns Oct. 7 attacks, bans members from rallies",Canada,https://nationalpost.com/news/canada/canadian-headed-muslim-group-condemns-oct-7-attacks-bans-members-from-rallies
189,2023-10-18,Michael Higgins: Trudeau doesn't have the moral authority to call for unity,NP Comment,https://nationalpost.com/opinion/michael-higgins-trudeau-doesnt-have-the-moral-authority-to-call-for-unity
190,2023-10-18,"Canada will remain a 'friend' to Israel, says Trudeau at antisemitism conference",Canada,https://nationalpost.com/news/canada/canada-israel-trudeau-antisemitism
191,2023-10-18,"Israel-Hamas war updates: British PM heads to Israel for meeting with Netanyahu, other Mideast leaders",Israel & Middle East,https://nationalpost.com/news/world/israel-middle-east/israel-hamas-war-day-12
192,2023-10-18,"Biden backs Israel, suggests 'other team' to blame for Gaza hospital blast",Canada,https://nationalpost.com/news/canada/biden-israel-gaza-hospital-blast
193,2023-10-18,"Joe Oliver: No, Israel's military response does not need to be 'proportionate'",NP Comment,https://nationalpost.com/opinion/no-israels-military-response-does-not-need-to-be-proportionate
194,2023-10-18,New Israeli ambassador on Canada's support: 'We appreciate that. We don't take it for granted',Canadian Politics,https://nationalpost.com/news/politics/new-israeli-ambassador-appreciates-canada-support
195,2023-10-18,Jamie Sarkonak: Hamas' failure to maintain utilities isn't 'collective punishment' by Israel,NP Comment,https://nationalpost.com/opinion/jamie-sarkonak-hamas-failure-to-maintain-utilities-isnt-collective-punishment-by-israel
196,2023-10-18,Several Liberal MPs call for Israel-Hamas ceasefire,Canadian Politics,https://nationalpost.com/news/politics/liberal-mp-calls-for-israel-hamas-ceasefire-another-decries-butchery-in-gaza
197,2023-10-18,"Letters: The world needs to eliminate Hamas, or risks World War 3",NP Comment,https://nationalpost.com/opinion/letters-the-world-needs-to-eliminate-hamas-or-risks-world-war-3
198,2023-10-18,In the news today: Israel-Hamas war roils as Canadians fear peace is impossible,PMN Canada,https://nationalpost.com/pmn/news-pmn/canada-news-pmn/in-the-news-today-israel-hamas-war-roils-as-canadians-fear-peace-is-impossible
199,2023-10-18,FIRST READING: The conspicuous silence of the Canadian Anti-Hate Network,NP Comment,https://nationalpost.com/opinion/conspicuous-silence-of-the-canadian-anti-hate-network
200,2023-10-18,"As Israel evacuates, why some Israeli-Canadians are staying behind",Israel & Middle East,https://nationalpost.com/news/world/israel-middle-east/israeli-canadians-defying-israel-evacuation
201,2023-10-18,Aerial photos reveal scene of Gaza hospital explosion — a charred parking lot,Israel & Middle East,https://nationalpost.com/news/world/israel-middle-east/israel-gaza-hospital-al-ahli
202,2023-10-18,Ontario legislature may censure MPP for statement on Israel-Hamas war,News,https://nationalpost.com/news/ontario-legislature-may-censure-mpp-for-statement-on-israel-hamas-war
203,2023-10-18,"Hamas is answering phone calls with four words, relatives of hostages say",World,https://nationalpost.com/news/world/hamas-hostages-four-words
204,2023-10-19,"Trudeau awaiting ‘final conclusions’ on responsibility for Gaza hospital explosion, draws rebukes",Canadian Politics,https://nationalpost.com/news/politics/israel-justin-trudeau-gaza-hospital-blame
205,2023-10-19,In the news today: Israel's envoy to Canada warns of 'fine line' in free speech,PMN Canada,https://nationalpost.com/pmn/news-pmn/canada-news-pmn/in-the-news-today-israels-envoy-to-canada-warns-of-fine-line-in-free-speech
206,2023-10-19,"Drones attack a US military base in southern Syria and there are minor injuries, US officials say",PMN News,https://nationalpost.com/pmn/news-pmn/drones-attack-a-us-military-base-in-southern-syria-and-there-are-minor-injuries-us-officials-say
207,2023-10-19,"John Robson: To stop the poisonous radicalism within academia, privatize universities",NP Comment,https://nationalpost.com/opinion/to-stop-the-poisonous-radicalism-within-academia-privatize-universities
208,2023-10-19,CBC says now is not the time to review its language around Hamas,Canada,https://nationalpost.com/news/canada/cbc-language-hamas-terrorists-israel
209,2023-10-19,Chris Selley: The unbearable alikeness of Canadian universities,NP Comment,https://nationalpost.com/opinion/the-unbearable-sameness-of-canadian-universities
210,2023-10-19,Israel-Hamas War updates: U.S. shoots down missiles from Yemen believed to be aimed at Israel,Israel & Middle East,https://nationalpost.com/news/world/israel-middle-east/https-nationalpost-com-news-world-israel-middle-east-israel-hamas-war-day-13
211,2023-10-19,North Korea may have supplied Hamas weapons used to attack Israel,World,https://nationalpost.com/news/world/north-korea-hamas-weapons
212,2023-10-19,Why you might have just gotten a 'climate cheque' from the Liberals,Canada,https://nationalpost.com/news/canada/climate-cheque-explainer
213,2023-10-19,Israeli Consul General Paul Hirschson: Officials should not be so quick to embrace Hamas lies,NP Comment,https://nationalpost.com/opinion/officials-should-not-be-so-quick-to-embrace-hamas-lies
214,2023-10-19,Ontario MPP Sarah Jama sends cease-and-desist letter to Doug Ford over his response to her Gaza statement,Canadian Politics,https://nationalpost.com/news/politics/ontario-ndp-mpp-sends-cease-and-desist-letter-to-doug-ford-over-his-response-to-her-gaza-statement
215,2023-10-19,Is it a war crime to kill civilians? Only sometimes. Here's what international law really says,Israel & Middle East,https://nationalpost.com/news/world/israel-middle-east/israel-hamas-war-laws
216,2023-10-19,"Gil Troy: Students, it's time to find your courage and confront Hamas apologists on campus",NP Comment,https://nationalpost.com/opinion/students-its-time-to-find-your-courage-and-confront-hamas-apologists-on-campus
217,2023-10-19,Ivison: Canadians need to realize Hamas just wants to kill all Jews,NP Comment,https://nationalpost.com/opinion/ivison-hamas-just-wants-to-kill-all-jews
218,2023-10-20,Ex-Prime Minister David Cameron makes shock return to U.K. government as foreign secretary,News,https://nationalpost.com/news/britains-labour-opposition-has-won-2-big-prizes-in-momentum-building-special-elections
219,2023-10-20,"FIRST READING: As a spooked Europe cracks down on pro-Hamas rallies, Canada ... doesn't",NP Comment,https://nationalpost.com/opinion/europe-cracks-down-on-pro-hamas-rallies-canada-does-nott
220,2023-10-20,Canadian evacuation flights from Israel scale back as tensions grow along Lebanon border,News,https://nationalpost.com/news/canada-reduces-evacuation-flights-from-israel
221,2023-10-20,Avi Benlolo: Trudeau Liberals leave world questioning whose side Canada is on — the terrorists or their victims?,NP Comment,https://nationalpost.com/opinion/trudeau-liberals-leave-world-questioning-whose-side-canada-is-on-the-terrorists-or-their-victims
222,2023-10-20,"Israel-Hamas War updates: Nobel peace laureates demand Hamas release child hostages, call it 'a war crime'",Israel & Middle East,https://nationalpost.com/news/world/israel-middle-east/israel-hamas-war-day-14
223,2023-10-20,RCMP tells owners to return misidentified fully automatic gun allowed into Canada,Canada,https://nationalpost.com/news/canada/fully-automatic-gun-allowed-into-canada
224,2023-10-20,Israel-Hamas war: How to avoid misinformation when sharing imagery on social media,PMN Canada,https://nationalpost.com/pmn/news-pmn/canada-news-pmn/israel-hamas-war-how-to-avoid-misinformation-when-sharing-imagery-on-social-media
225,2023-10-20,Israeli girl with autism thought kidnapped by Hamas found dead,Israel & Middle East,https://nationalpost.com/news/world/israel-middle-east/israeli-girl-with-autism-thought-kidnapped-by-hamas-found-dead
226,2023-10-20,Michael Taube: Post-terror-attack rallies demolish hope for a two-state solution,NP Comment,https://nationalpost.com/opinion/michael-taube-post-terror-attack-rallies-demolish-hope-for-a-two-state-solution
227,2023-10-20,"'You are Jewish', man says as he allegedly punches a woman on subway: NYPD",World,https://nationalpost.com/news/world/you-are-jewish-man-allegedly-punches-woman-on-subway
228,2023-10-20,"Troops injured in drone attack on U.S. bases in Iraq and Syria, officials say",News,https://nationalpost.com/news/drone-attack-iraq-syria-us-bases
229,2023-10-20,All the lies Hamas has told the world in war against Israel,News,https://nationalpost.com/news/hamas-war-lies
230,2023-10-20,Hamas releases two American hostages to refute ‘fascist’ Biden administration,World,https://nationalpost.com/news/world/hamas-releases-two-american-hostages
231,2023-10-20,Trudeau admits Liberal caucus divide over Israel-Hamas war. Says differences are 'source of strength',News,https://nationalpost.com/news/justin-trudeau-israel-hamas-war
232,2023-10-20,Number of confirmed Israeli hostages reaches 203,World,https://nationalpost.com/news/world/number-of-confirmed-israeli-hostages-reaches-203
233,2023-10-20,In the news today: Canada removes 41 diplomats from India after immunity threats,PMN Canada,https://nationalpost.com/pmn/news-pmn/canada-news-pmn/in-the-news-today-canada-removes-41-diplomats-from-india-after-immunity-threats
234,2023-10-21,Swiss elect their parliament on Sunday with worries about environment and migration high in minds,PMN News,https://nationalpost.com/pmn/news-pmn/swiss-elect-their-parliament-on-sunday-with-worries-about-environment-and-migration-high-in-minds
235,2023-10-21,Israel says it doesn't plan long-term control of Gaza after war with Hamas,Israel & Middle East,https://nationalpost.com/news/world/israel-middle-east/israel-doesnt-plan-long-term-gaza-control
236,2023-10-21,Rex Murphy redux: Revisiting the 2014 Gaza War,NP Comment,https://nationalpost.com/opinion/rex-murphy-redux-revisiting-the-2014-gaza-war
237,2023-10-21,Sabrina Maddeaux: Liberals continue to punish farmers with inflation-inducing carbon tax,NP Comment,https://nationalpost.com/opinion/sabrina-maddeaux-liberals-continue-to-punish-farmers-with-inflation-inducing-carbon-tax
238,2023-10-21,Vivian Bercovici: The Trudeau Liberals' deafening silence in the face of Hamas horrors,NP Comment,https://nationalpost.com/opinion/the-trudeau-liberals-deafening-silence-in-the-face-of-hamas-horrors
239,2023-10-21,Israel-Hamas War updates: Aid moving into Gaza as fighting intensifies along border with Lebanon,Israel & Middle East,https://nationalpost.com/news/world/israel-middle-east/israel-hamas-war-day-15
240,2023-10-21,Joly and Hussen at 'Cairo Peace Summit' to discuss Israel-Hamas War,Israel & Middle East,https://nationalpost.com/news/world/israel-middle-east/joly-and-hussen-at-cairo-peace-summit-to-discuss-israel-hamas-war
241,2023-10-21,Canadian in Gaza says Israeli air strikes now relentless ahead of ground invasion,PMN Canada,https://nationalpost.com/pmn/news-pmn/canada-news-pmn/canadian-trapped-in-gaza-says-first-load-of-aid-barely-helping-humanitarian-crisis
242,2023-10-22,"Six months after scaling back on Twitter/X, CBC has no plans to return",News,https://nationalpost.com/news/six-months-after-scaling-back-on-twitter-x-cbc-has-no-plans-to-return
243,2023-10-22,"Michael Higgins: Canada faults Hamas for Gaza hospital blast, but Trudeau and Joly remain oddly quiet",NP Comment,https://nationalpost.com/opinion/michael-higgins-canada-faults-hamas-for-gaza-hospital-blast-but-trudeau-and-joly-remain-oddly-quiet
244,2023-10-22,Letters: 'Those who support terrorism should have no voice in Canada',NP Comment,https://nationalpost.com/opinion/letters-those-who-support-terrorism-should-have-no-voice-in-canada
245,2023-10-22,"NP View: In Israel's time of need, our frequent-flyer PM opts for a staycation",NP Comment,https://nationalpost.com/opinion/in-israels-time-of-need-our-frequent-flyer-pm-opts-for-a-staycation
246,2023-10-22,Raymond J. de Souza: Prepare for a dangerous new world disorder,NP Comment,https://nationalpost.com/opinion/raymond-j-de-souza-prepare-for-a-dangerous-new-world-disorder
247,2023-10-22,Barbara Kay: The insidious hatred that spawned the Holocaust and Hamas' latest pogrom,NP Comment,https://nationalpost.com/opinion/the-insidious-hatred-that-spawned-the-holocaust-and-hamas-latest-pogrom
248,2023-10-22,Weekend Posted: Some great stories you may have missed,News,https://nationalpost.com/news/weekend-posted-some-great-stories-you-may-have-missed-16
249,2023-10-22,Canada's Defence Minister 'confident' Israel didn't strike hospital in Gaza,Israel & Middle East,https://nationalpost.com/news/world/israel-middle-east/canadas-defence-minister-confident-israel-didnt-strike-hospital-in-gaza
250,2023-10-22,Israel-Hamas War updates: Israel stepping up attacks as second aid convoy enters Gaza,Israel & Middle East,https://nationalpost.com/news/world/israel-middle-east/israel-hamas-war-updates-israel-stepping-up-attacks-as-second-aid-convoy-enters-gaza
251,2023-10-22,A Swiss populist party rebounds and the Greens sink in the election. That's a big change from 2019,PMN News,https://nationalpost.com/pmn/news-pmn/the-swiss-are-electing-their-parliament-polls-show-right-wing-populists-socialists-may-fare-well
252,2023-10-22,Three arrested at Calgary demonstrations related to Middle East conflict,PMN Canada,https://nationalpost.com/pmn/news-pmn/canada-news-pmn/three-arrested-at-calgary-demonstrations-related-to-middle-east-conflict
