,datetime,title,tag,url
0,2023-10-07,Israeli rescue service says it retrieved about 260 bodies from a music festival attacked by Hamas,News,https://nationalpost.com/news/palestinians-say-at-least-198-killed-in-gaza-in-israeli-retaliation-for-a-hamas-assault-into-israel
1,2023-10-07,"Canada increases police presence at synagogues, mosques following Hamas attack on Israel",Canada,https://nationalpost.com/news/canada/canadian-politicians-condemn-deadly-surprise-hamas-attack-on-israel
2,2023-10-07,Hamas claims 163 Israeli captives taken to Gaza,News,https://nationalpost.com/news/hamas-claims-53-israeli-captives-taken-to-gaza
3,2023-10-07,Canadian describes surprise Hamas attack on Israel as politicians condemn violence,PMN Canada,https://nationalpost.com/pmn/news-pmn/canada-news-pmn/canadian-politicians-condemn-deadly-surprise-hamas-attack-on-israel-2
4,2023-10-07,George Monastiriakos: There is no moral equivalence between Israel and Hamas,NP Comment,https://nationalpost.com/opinion/george-monastiriakos-there-is-no-moral-equivalence-between-israel-and-hamas
5,2023-10-07,Vivian Bercovici: Hamas carnage on Israel is on an unprecedented scale,NP Comment,https://nationalpost.com/opinion/hamas-carnage-on-israelis-is-on-an-unprecedented-scale
6,2023-10-08,Canadians stuck in Israel amid cancelled flights and reports of Canadians killed and missing,Israel & Middle East,https://nationalpost.com/news/world/israel-middle-east/canadians-stuck-in-israel
7,2023-10-08,Barbara Kay: Time for Israel to stop gambling and start winning,NP Comment,https://nationalpost.com/opinion/time-for-israel-to-stop-gambling-and-start-winning
8,2023-10-08,Avi Benlolo: The campaign to justify Hamas' mass murder of innocent civilians is well underway,NP Comment,https://nationalpost.com/opinion/the-campaign-to-justify-hamas-mass-murder-of-innocent-civilians-is-well-underway
9,2023-10-08,'I saw masses of wounded people': Israeli rave becomes terrorists’ shooting gallery,News,https://nationalpost.com/news/i-saw-masses-of-wounded-people-israeli-rave-becomes-terrorists-shooting-gallery
10,2023-10-08,"Terry Glavin: As Israeli innocents are hunted and murdered, certain Canadian ‘progressives’ choose to celebrate",NP Comment,https://nationalpost.com/opinion/canadian-progressives-celebrate-israel-war
11,2023-10-09,Vancouver man killed in Hamas attack on Israeli music festival,Canada,https://nationalpost.com/news/local-news/vancouver-man-missing-southern-israel/wcm/ccc897b8-dc28-4f2c-994d-a281a9e772d1
12,2023-10-09,Canada absent from major nations’ statement on Israel violence,Israel & Middle East,https://nationalpost.com/news/world/israel-middle-east/canada-left-out-of-joint-g7-statement-condemning-hamas-attack-on-israel
13,2023-10-09,"Montreal man among those killed in attack on Israel by Hamas militants, family says",PMN Canada,https://nationalpost.com/pmn/news-pmn/canada-news-pmn/montreal-man-among-those-killed-in-attack-on-israel-by-hamas-militants-family-says
14,2023-10-09,"Canadian died a 'hero' amid music festival massacre in Israel, father says",News,https://nationalpost.com/news/canadian-died-a-hero-amid-music-festival-massacre
15,2023-10-09,Vivian Bercovici: Canada leaves its citizens adrift in Israeli chaos,Israel & Middle East,https://nationalpost.com/news/world/israel-middle-east/vivian-bercovici-canada-leaves-its-citizens-adrift-in-israeli-chaos
16,2023-10-09,"As false war information spreads on X, Musk promotes unvetted accounts",News,https://nationalpost.com/news/as-false-war-information-spreads-on-x-musk-promotes-unvetted-accounts
17,2023-10-09,Five things to know about the war between Israel and Hamas,Israel & Middle East,https://nationalpost.com/news/world/israel-middle-east/5-things-to-know-as-israel-declares-war-on-hamas
18,2023-10-09,Michael Higgins: Trudeau must condemn these obscene rallies that shame Canada,NP Comment,https://nationalpost.com/opinion/trudeau-hamas-israel-rallies
19,2023-10-09,"Israel vows complete siege of Gaza, cutting off food and fuel, as Hamas fires rockets",News,https://nationalpost.com/news/israel-vows-complete-siege-of-gaza-after-incursion-by-hamas
20,2023-10-09,"Jesse Kline: In Israel, protesters get a sobering reminder of what's really at stake",NP Comment,https://nationalpost.com/opinion/in-israel-protesters-get-a-sobering-reminder-of-whats-really-at-stake
21,2023-10-09,Harry Rakowski: Why do we accept mediocrity in health care?,NP Comment,https://nationalpost.com/opinion/harry-rakowski-why-do-we-accept-mediocrity-in-health-care
22,2023-10-09,Israel declares war on Hamas: Airstrikes bombard Gaza as U.S. sends help,Israel & Middle East,https://nationalpost.com/news/world/israel-middle-east/israel-declares-war-hamas-gaza
23,2023-10-10,Ottawa downplays exclusion from allies' joint statement denouncing Hamas terrorist attacks,News,https://nationalpost.com/news/ottawa-downplays-exclusion-from-allies-joint-statement-denouncing-hamas
24,2023-10-10,"'Sheer evil': Biden condemns Hamas attack on Israel, warns others not to get involved",World,https://nationalpost.com/news/world/sheer-evil-biden-condemns-hamas-attack-on-israel-warns-others-not-to-get-involved
25,2023-10-10,Canadians in Israel frustrated by lack of support from federal government,Canada,https://nationalpost.com/news/canada/canadians-israel-frustrated-lack-of-support-feds
26,2023-10-10,"Israel-Hamas war: Rockets, then murder and kidnapping — how the first day unfolded",Israel & Middle East,https://nationalpost.com/news/world/israel-middle-east/israel-hamas-war-how-first-day-unfolded
27,2023-10-10,John Ivison: Tolerating the glorification of terror and slaughter is societal suicide,NP Comment,https://nationalpost.com/opinion/tolerating-glorification-of-terror-is-societal-suicide
28,2023-10-10,Sabrina Maddeaux: Don't look away from the true horrors of what Hamas did in Israel,NP Comment,https://nationalpost.com/opinion/sabrina-maddeaux-dont-look-away-from-the-true-horrors-of-what-hamas-did-in-israel
29,2023-10-10,Here's what we know about Canadian victims of Hamas attacks,News,https://nationalpost.com/news/canadians-killed-missing-israel-hamas-war
30,2023-10-10,Hamas attacks lead Quebec to delay opening of representative office in Israel,Canada,https://nationalpost.com/news/canada/quebec-delays-opening-office-israel-hamas-attacks
31,2023-10-10,Two Canadians killed by Hamas in Israel remembered as proud and loving,PMN Canada,https://nationalpost.com/pmn/news-pmn/canada-news-pmn/vancouver-man-ben-mizrachi-killed-by-hamas-in-israel-school-head
32,2023-10-10,Hamas: What to know about the terrorist group behind Israel attack,Israel & Middle East,https://nationalpost.com/news/world/israel-middle-east/terrorist-group-hamas-israel-attack
33,2023-10-10,'Help us': 10-year-old texts mom after Hamas terrorists kill her father in Israel,News,https://nationalpost.com/news/help-us-10-year-old-texts-mom-after-hamas-terrorists-kill-her-father-in-israel
34,2023-10-10,Joe Oliver: Israel merits Canada’s unwavering support,NP Comment,https://nationalpost.com/opinion/israel-merits-canadas-unwavering-support
35,2023-10-10,What to know about the hostages taken from Israel in Hamas attack,Israel & Middle East,https://nationalpost.com/news/world/israel-middle-east/hostages-hamas-attack-israel
36,2023-10-10,Photos and survivor accounts reveal Hamas slaughter at Israeli music festival: 'This is hell',Canada,https://nationalpost.com/news/canada/photos-israel-music-festival-hamas-attack
37,2023-10-10,Canadian who returned from Syria prison camp faces terrorism charge,Canada,https://nationalpost.com/news/canada/canadian-who-returned-from-syria-prison-camp-faces-terrorism-charge
38,2023-10-10,Canadian political leaders denounce Hamas attack on Israel,News,https://nationalpost.com/news/canadian-political-leaders-denounce-hamas-attack-on-israel
39,2023-10-10,Hamas 'came to kill' but a 16-year-old survived after being guided to safety by a text chain,World,https://nationalpost.com/news/world/hamas-came-to-kill-but-a-teen-survived-using-group-texts
40,2023-10-10,"Israel-Hamas War Day 4: Canada planning airlift of citizens, permanent residents from Israel",Israel & Middle East,https://nationalpost.com/news/world/israel-middle-east/israel-hamas-war-live-day-4
41,2023-10-10,FIRST READING: A brief history of Trudeau describing things that never happened,NP Comment,https://nationalpost.com/opinion/history-of-trudeau-describing-things-that-never-happened
42,2023-10-10,Tasha Kheiriddin: The civilized world finally sees Hamas for the murder cult that it is,NP Comment,https://nationalpost.com/opinion/civilized-world-sees-hamas-for-the-murder-cult-that-it-is
43,2023-10-10,"Russia will only resume nuclear tests if the U.S. does it first, says Russian diplomat",News,https://nationalpost.com/news/russia-will-only-resume-nuclear-tests-if-the-us-does-it-first-russian-diplomat-says
44,2023-10-10,"'Hamas are terrorists,' Trudeau says, amid pro-Palestinian rallies across Canada",Israel & Middle East,https://nationalpost.com/news/world/israel-middle-east/hamas-are-terrorists-justin-trudeau-says
45,2023-10-10,Hamas terrorists murdered as many as 40 babies in village attack: IDF soldiers,Israel & Middle East,https://nationalpost.com/news/world/israel-middle-east/babies-murdered-hamas-terrorist-attack
46,2023-10-11,Terry Glavin: Hamas supporters enjoy safe haven and left-wing backing in Canada,NP Comment,https://nationalpost.com/opinion/terry-glavin-hamas-supporters-enjoy-safe-haven-and-left-wing-support-in-canada
47,2023-10-11,John Ivison: The leaders of the free world have no time left for unserious Canada,NP Comment,https://nationalpost.com/opinion/john-ivison-leaders-free-world-no-time-unserious-canada
48,2023-10-11,"'Everybody’s afraid' Mideast conflict could lessen support for Ukraine, Zelenskyy says at global defence meeting",World,https://nationalpost.com/news/world/everybodys-afraid-mideast-conflict-could-lessen-support-for-ukraine-zelenskyy-says-at-global-defence-meeting
49,2023-10-11,"Chris Selley: Let the pro-Hamas protests go on, so that Canadians can face the vileness",NP Comment,https://nationalpost.com/opinion/why-we-should-let-pro-hamas-protests-go-on
50,2023-10-11,"Missing woman whose half-naked body was put on display by Hamas is alive, mother says",Israel & Middle East,https://nationalpost.com/news/world/missing-woman-whose-half-naked-body-was-put-on-display-by-hamas-believed-to-be-alive/wcm/ad404061-a754-4508-ace2-ce8645f5c1dc
51,2023-10-11,Netanyahu details Hamas atrocities as Israel forms wartime unity government,Israel & Middle East,https://nationalpost.com/news/world/israel-middle-east/netanyahu-details-hamas-atrocities
52,2023-10-11,Air Canada pilot loses job over 'unacceptable' posts against Israel,Canada,https://nationalpost.com/news/canada/air-canada-pilot-loses-job-over-unacceptable-posts-against-israel
53,2023-10-11,"Kansas becomes the 10th state to require 2-person train crews, despite the industry's objections",PMN News,https://nationalpost.com/pmn/news-pmn/kansas-becomes-the-10th-state-to-require-2-person-train-crews-despite-the-industrys-objections
54,2023-10-11,CBC tells journalists to not call Hamas 'terrorists' in leaked memo,News,https://nationalpost.com/news/cbc-tells-journalists-to-not-call-hamas-terrorists-in-leaked-memo
55,2023-10-11,Poilievre calls for 'more severe sanctions' on Iran in response to Hamas attacks,Canadian Politics,https://nationalpost.com/news/politics/poilievre-calls-for-tougher-sanctions-on-iran-hamas-attacks
56,2023-10-11,"Rahim Mohamed: Instead of serving its members, CUPE doubles down on support for Hamas' mass slaughter",NP Comment,https://nationalpost.com/opinion/instead-of-serving-its-members-cupe-doubles-down-on-support-for-hamas-mass-slaughter
57,2023-10-11,Family of Canadian-Israeli woman taken hostage in Gaza calls on Canada to help,World,https://nationalpost.com/news/world/family-of-woman-taken-hostage-in-gaza-asks-canada-for-help
58,2023-10-11,Noah Lew: Those who celebrate unspeakable horrors committed against Israelis must be held accountable,NP Comment,https://nationalpost.com/opinion/those-who-celebrate-unspeakable-horrors-committed-against-israelis-must-be-held-accountable
59,2023-10-11,Canadians in Israel desperate to leave will be evacuated using military flights: Joly,Canadian Politics,https://nationalpost.com/news/politics/israel-canada-military-flights
60,2023-10-11,Ontario NDP leader asks Hamilton MPP to retract statement on Israel-Gaza war,Canada,https://nationalpost.com/news/provincial/ontario-ndp-leader-asks-hamilton-mpp-to-retract-statement-on-israel-gaza-war/wcm/20e93b4b-66f4-4473-b23e-9f2d7a88ba8d
61,2023-10-11,Israel-Hamas War Day 5: Biden calls attack 'the deadliest day for Jews since the Holocaust',Israel & Middle East,https://nationalpost.com/news/world/israel-middle-east/israel-hamas-war-live-day-5
62,2023-10-11,FIRST READING: The 'pro-Palestinian' rallies that explicitly celebrated mass-murder,Canada,https://nationalpost.com/news/canada/pro-palestinian-rallies-that-explicitly-celebrated-mass-murder
63,2023-10-11,Jamie Sarkonak: Canadian academics shrug at horrendous violence perpetrated against Israelis,NP Comment,https://nationalpost.com/opinion/canadian-academics-decolonization-israel
64,2023-10-11,Petula Dvorak: American Jewry are under siege,NP Comment,https://nationalpost.com/opinion/american-jewry-are-under-siege
65,2023-10-11,Derek H. Burney: Canada's hollow place in the world,NP Comment,https://nationalpost.com/opinion/canadas-hollow-place-in-the-world
66,2023-10-11,We're witnessing the highest rise of antisemitism in 50 years: Irwin Cotler on the global evil,Israel & Middle East,https://nationalpost.com/news/world/israel-middle-east/highest-rise-of-antisemitism-in-50-years-irwin-cotler
67,2023-10-11,In the news today: Health ministers in Charlottetown and Joly talks Israel airlifts,PMN Canada,https://nationalpost.com/pmn/news-pmn/canada-news-pmn/in-the-news-today-health-ministers-in-charlottetown-and-key-convoy-trial-decision
68,2023-10-11,Ottawa to keep sending money to Gaza as groups call for checks against terror funding,Canadian Politics,https://nationalpost.com/news/politics/canadian-aid-money-gaza-terror-funding
69,2023-10-12,Canadian police forces upping patrols in response to Israel-Hamas war,PMN Canada,https://nationalpost.com/pmn/news-pmn/canada-news-pmn/canadian-police-forces-upping-local-patrols-in-response-to-israel-hamas-war
70,2023-10-12,'Whatever we can do to help': Why some Canadians opting to stay in Israel after Hamas terror attacks,Canadian Politics,https://nationalpost.com/news/politics/some-canadians-staying-behind-in-israel
71,2023-10-12,"Canada committing $10 million in humanitarian aid for Israel, Gaza",Canada,https://nationalpost.com/news/canada/canada-humanitarian-aid-israel-gaza
72,2023-10-12,Canadian tour companies reeling as people rethink Israel travel plans,Canada,https://nationalpost.com/news/canada/canadian-tour-companies-reeling-as-people-rethink-israel-travel-plans
73,2023-10-12,NTSB chair says new locomotive camera rule is flawed because it excludes freight railroads,PMN News,https://nationalpost.com/pmn/news-pmn/ntsb-chair-says-new-locomotive-camera-rule-is-flawed-because-it-excludes-freight-railroads
74,2023-10-12,"What we know about the weapons of Israel, Hamas and Hezbollah amid threats of ground war",Israel & Middle East,https://nationalpost.com/news/world/israel-middle-east/israel-hamas-hezbollah-us-weapons
75,2023-10-12,'No other option': Canada calls for humanitarian corridor to get citizens out of Gaza,Canadian Politics,https://nationalpost.com/news/politics/canada-calls-for-gaza-humanitarian-corridor
76,2023-10-12,Tasha Kheiriddin: The 'decolonization' movement will condemn us to the brutality of our past,NP Comment,https://nationalpost.com/opinion/the-decolonization-movement-will-condemn-us-to-the-brutality-of-our-past
77,2023-10-12,"Vancouver women allege they were threatened with murder, sexual assault after Israeli vigil",News,https://nationalpost.com/news/vancouver-women-threatened-israeli-vigil
78,2023-10-12,"Acts of courage: Amid horror, Israelis rise to the occasion",Israel & Middle East,https://nationalpost.com/news/world/israel-middle-east/acts-of-courage-amid-horror-israelis-rise-to-the-occasion
79,2023-10-12,"Who is Mohammed Deif, the mastermind behind Hamas's incursion on Israel?",Israel & Middle East,https://nationalpost.com/news/world/israel-middle-east/mohammed-deif-mastermind-behind-hamas-attack-on-israel
80,2023-10-12,Canadian military evacuation flight leaves Tel Aviv with 130 people on board,Canada,https://nationalpost.com/news/canada/canadian-military-evacuation-flight-leaves-tel-aviv-with-130-people-on-board
81,2023-10-12,Lisa Nackan: The silence of friends is deafening; indifference to the attack on Israel is dangerous,NP Comment,https://nationalpost.com/opinion/lisa-nackan-the-silence-of-friends-is-deafening-indifference-to-the-attack-on-israel-is-dangerous
82,2023-10-12,"Ontario New Democrat MPP apologizes for tweet attacking Israel, but doesn’t retract it",Canada,https://nationalpost.com/news/canada/ontario-new-democrat-mpp-apologizes-for-tweet-attacking-israel-but-doesnt-retract-it
83,2023-10-12,How does Israel's Iron Dome work?,Israel & Middle East,https://nationalpost.com/news/world/israel-middle-east/israel-gaza-iron-dome
84,2023-10-12,George Monastiriakos: Canadian progressives playing into the hands of our enemies,NP Comment,https://nationalpost.com/opinion/canadian-progressives-playing-into-the-hands-of-our-enemies
85,2023-10-12,"In the news today: Trudeau in Yellowknife, Canadian citizen killed in Israel",PMN Canada,https://nationalpost.com/pmn/news-pmn/canada-news-pmn/in-the-news-today-trudeau-in-yellowknife-canadian-citizen-killed-in-israel
86,2023-10-12,FIRST READING: Terrorist sympathizers on Parliament Hill – Canada's Palestinian extremism problem,Canada,https://nationalpost.com/news/canada/terrorist-sympathizers-on-parliament-hill-canadas-palestinian-extremism-problem
87,2023-10-12,Israel-Hamas War Day 6: Ex-Hamas official 'really worried' hostages in Gaza may be killed by Israeli bombardment,Israel & Middle East,https://nationalpost.com/news/world/israel-middle-east/israel-hamas-war-live-day-6
88,2023-10-12,Tzvi Kahn: Canada must secure the release of hostages without funding Hamas,NP Comment,https://nationalpost.com/opinion/tzvi-kahn-canada-must-secure-the-release-of-hostages-without-funding-hamas
89,2023-10-12,Israeli commander describes horrific massacre in ambushed village near Gaza,Israel & Middle East,https://nationalpost.com/news/world/israel-middle-east/israel-gaza-hamas-ambush
90,2023-10-12,"Harry Rakowski: Gaza war will be inevitably ugly, but it's Israel's only path to peace",NP Comment,https://nationalpost.com/opinion/harry-rakowski-gaza-war-will-be-inevitably-ugly-but-its-israels-only-path-to-peace
91,2023-10-13,"Howard Levitt: If your employer expresses sympathy for Hamas, here are your options",NP Comment,https://nationalpost.com/fp-work/employer-sympathy-hamas/wcm/1e94f1d3-94a0-4330-95d9-c057ba303ef2
92,2023-10-13,Survivors of the Israel music festival describe the horrifying day,News,https://nationalpost.com/news/survivors-israel-music-festival
93,2023-10-13,"RCMP calls for 'vigilance,' says any threats to Jewish community will be taken seriously",Canada,https://nationalpost.com/news/canada/israel-hamas-canada-day-of-jihad
94,2023-10-13,These are the graphic photos Israel released of burned babies to reveal horror of Hamas attack,Israel & Middle East,https://nationalpost.com/news/world/israel-middle-east/warning-graphic-content-hamas-terrorist-attack-israel
95,2023-10-13,Toronto rabbis call on other faith leaders to support Israel,Toronto,https://nationalpost.com/news/toronto/toronto-rabbis-faith-leaders-israel
96,2023-10-13,Canada working to evacuate citizens from Gaza as military flights continue out of Israel,Canada,https://nationalpost.com/news/canada/canada-evacuate-citizens-gaza-military-flights-israel
97,2023-10-13,Poilievre promises review of foreign aid to prevent money from financing terrorists,Canadian Politics,https://nationalpost.com/news/politics/poilievre-promises-review-foreign-aid-prevent-financing-terrorists
98,2023-10-13,Sabrina Maddeaux: Attack on Israel means Canada must toughen measures against Iran,NP Comment,https://nationalpost.com/opinion/attack-on-israel-means-canada-must-toughen-measures-against-iran
99,2023-10-13,Israeli-Canadian reservists say they’re ready to fight if needed,Israel & Middle East,https://nationalpost.com/news/world/israel-middle-east/israeli-canadian-reservists-say-theyre-ready-to-fight-if-needed
100,2023-10-13,'Where are your voices?' Toronto rabbis call on other faith leaders to support Israel,Toronto,https://nationalpost.com/news/toronto/toronto-rabbis-faith-leaders-israel
101,2023-10-13,Fears grow over whether Hezbollah will join Israel-Hamas war,World,https://nationalpost.com/news/world/hezbollah-israel-hamas-war-northern-border
102,2023-10-13,FIRST READING: The Canadian taxpayer money funding and enabling Hamas,Canada,https://nationalpost.com/news/canada/the-canadian-taxpayer-money-funding-and-enabling-hamas
103,2023-10-13,Older couple in Israel survives three Hamas assaults. Their neighbours were not so lucky,News,https://nationalpost.com/news/israel-hamas-survivors
104,2023-10-13,"Canadian doctor trapped in Gaza volunteers at hospital, urges entry of medical aid",PMN Canada,https://nationalpost.com/pmn/news-pmn/canada-news-pmn/canadian-doctor-trapped-in-gaza-volunteers-at-hospital-urges-entry-of-medical-aid
105,2023-10-13,"‘Unacceptable’ pro-Hamas statement by York student unions condemned by university, government",News,https://nationalpost.com/news/canadian-universities-face-challenges-navigating-israel-hamas-war
106,2023-10-13,"In the news today: Canadian doctor trapped in Gaza, Convoy trial in Ottawa",PMN Canada,https://nationalpost.com/pmn/news-pmn/canada-news-pmn/in-the-news-today-canadian-doctor-trapped-in-gaza-convoy-trial-in-ottawa
107,2023-10-13,Avi Benlolo: Rashida Tlaib's failure to condemn Hamas atrocities highlights insidiousness of antisemitism,NP Comment,https://nationalpost.com/opinion/rashida-tlaibs-failure-to-condemn-hamas-atrocities-highlights-insidiousness-of-antisemitism
108,2023-10-13,Israeli diplomat attacked in Beijing as Hamas calls for global 'Day of Jihad',News,https://nationalpost.com/news/israeli-diplomat-attacked-in-beijing-as-hamas-calls-for-global-day-of-jihad
109,2023-10-13,Weekly News Quiz: On which anniversary did Hamas launch its terror attack on Israel?,News,https://nationalpost.com/news/weekly-news-quiz-on-which-anniversary-did-hamas-launch-its-terror-attack-on-israel
110,2023-10-13,Danielle Kubes: This is why Israel exists — so Jews can finally defend themselves,NP Comment,https://nationalpost.com/opinion/this-is-why-israel-exists-so-jews-can-finally-fight-back
111,2023-10-13,"J.D. Tuccille: U.S. withdraws as global policeman, leaving others to pick up slack",NP Comment,https://nationalpost.com/opinion/j-d-tuccille-u-s-withdraws-as-global-policeman-leaving-others-to-pick-up-slack
112,2023-10-13,Israel orders evacuation of 1 million in Gaza ahead of expected ground invasion,Canada,https://nationalpost.com/news/canada/israel-evacuation-gaza-ground-invasion
113,2023-10-13,Remain vigilant as calls for global 'Day of Jihad' circulate online: FBI,News,https://nationalpost.com/news/israel-hamas-day-of-jihad
114,2023-10-13,Israel-Hamas War Day 7: Netanyahu vows to 'destroy Hamas' ahead of expected ground invasion,Israel & Middle East,https://nationalpost.com/news/world/israel-middle-east/israel-hamas-war-day-7
115,2023-10-13,Hamas fighters were seen training in plain sight weeks before border breach,World,https://nationalpost.com/news/world/hamas-fighters-training-videos
116,2023-10-13,Why did Hamas attack now? What we know about its motives and strategy,Israel & Middle East,https://nationalpost.com/news/world/israel-middle-east/why-did-hamas-attack-israel-now
117,2023-10-14,Joly announces plans to evacuate Canadians: 'Gaza is one of the worst places on Earth to be right now',News,https://nationalpost.com/news/joly-announces-plan-to-help-canadians-evacuate-from-west-bank
118,2023-10-14,Israeli forces: Hamas chief in Gaza and his entire command team 'are in our sights',News,https://nationalpost.com/news/israeli-forces-hamas-in-gaza-chief-and-his-entire-command-team-are-in-our-sights
119,2023-10-14,"Canadian Israeli woman, missing since ambush at musical festival, has died: family",PMN Canada,https://nationalpost.com/pmn/news-pmn/canada-news-pmn/canadian-israeli-woman-missing-since-ambush-at-musical-festival-has-died-family
120,2023-10-14,"Conrad Black: Following Hamas attack, no one can deny Israel’s claim to righteousness",NP Comment,https://nationalpost.com/opinion/following-hamas-attack-no-one-can-deny-israels-claim-to-righteousness
121,2023-10-14,Plan for Canadians fleeing Gaza via Egyptian border crossing 'cancelled',Canada,https://nationalpost.com/news/canada/plan-for-canadians-fleeing-gaza-via-egyptian-border-crossing-cancelled
122,2023-10-14,Canadian-Israeli woman missing since Hamas's surprise attack declared dead,Canada,https://nationalpost.com/news/canada/israel-hamas-canadian-victims
123,2023-10-14,'More Jews were killed last Shabbat ... than on any other day since the Holocaust': U.S. rabbi,News,https://nationalpost.com/news/more-jews-were-killed-last-shabbat-than-on-any-other-day-since-the-holocaust-u-s-rabbi
124,2023-10-14,How one doctor held hostage by Hamas was miraculously rescued,News,https://nationalpost.com/news/hamas-hostage-survivor
125,2023-10-14,"Rex Murphy: Antisemitism's vile, unending hatred never ceases to smoulder",NP Comment,https://nationalpost.com/opinion/antisemitisms-vile-unending-hatred-never-ceases-to-smoulder
