,datetime,title,tag,url
253,2023-10-23,Japan's Kishida plans an income tax cut for households and corporate tax breaks,PMN News,https://nationalpost.com/pmn/news-pmn/japans-kishida-plans-an-income-tax-cut-for-households-and-corporate-tax-breaks
254,2023-10-23,Comedian Dave Chappelle under fire for anti-Israel set,Israel & Middle East,https://nationalpost.com/news/world/israel-middle-east/comedian-dave-chappelle-under-fire-for-anti-israel-set
255,2023-10-23,In the news today: Defence Minister to face questions about Gaza hospital blast,PMN Canada,https://nationalpost.com/pmn/news-pmn/canada-news-pmn/in-the-news-today-defence-minister-to-face-questions-about-gaza-hospital-blast
256,2023-10-23,J.D. Tuccille: Internal party squabbles are why U.S. can't get anything done,NP Comment,https://nationalpost.com/opinion/j-d-tuccille-internal-party-squabbles-are-why-u-s-cant-get-anything-done
257,2023-10-23,Joe Roberts: Progressive calls for ceasefire in Gaza miss the bigger picture,NP Comment,https://nationalpost.com/opinion/joe-roberts-progressive-calls-for-ceasefire-in-gaza-miss-the-bigger-picture
258,2023-10-23,Ian Cooper: Israel has no choice but to wage war on Hamas,NP Comment,https://nationalpost.com/opinion/israel-has-no-choice-but-to-wage-war-on-hamas
259,2023-10-23,BBC to stop calling Hamas 'militants' amid outcry,News,https://nationalpost.com/news/bbc-to-stop-calling-hamas-militants-amid-outcry
260,2023-10-23,Diane Francis: Hamas left Israel with no good options,Financial Post,https://nationalpost.comhttps://financialpost.com/diane-francis/hamas-left-israel-no-good-options
261,2023-10-23,Israel-Hamas War updates: Hamas frees two more hostages,Israel & Middle East,https://nationalpost.com/news/world/israel-middle-east/israel-hamas-war-day-17
262,2023-10-23,Toronto mayor denounces pro-Palestinian protesters who targeted Jewish-owned cafe,Toronto,https://nationalpost.com/news/toronto/toronto-pro-palestinian-protesters-cafe-landwer
263,2023-10-23,FIRST READING: How Canada spent millions pushing an ideology used to frame Jews as oppressors,NP Comment,https://nationalpost.com/opinion/canada-crt-anti-racism-initiative
264,2023-10-23,Ontario NDP removes member from caucus for comments about the Israel-Hamas conflict,Canada,https://nationalpost.com/news/canada/ndp-removes-sarah-jama-for-hamas-comments
265,2023-10-23,Bill Blair to face further questions about Canada's evidence on hospital strike in Gaza,World,https://nationalpost.com/news/world/bill-blair-gaza-hospital-strike-evidence
266,2023-10-23,John Ivison: The Liberals are divided on Israel and completely adrift on foreign policy,NP Comment,https://nationalpost.com/opinion/john-ivison-liberals-divided-on-israel-and-completely-adrift-on-foreign-policy
267,2023-10-24,In the news today: Israel increases strikes on Gaza ahead of expected ground invasion,PMN Canada,https://nationalpost.com/pmn/news-pmn/canada-news-pmn/in-the-news-today-israel-increases-strikes-on-gaza-ahead-of-expected-ground-invasion
268,2023-10-24,"Hamas left behind this booby-trapped pink backpack, Israel says",Israel & Middle East,https://nationalpost.com/news/world/israel-middle-east/hamas-backpack-idf
269,2023-10-24,Cyprus police say they have dismantled the third people smuggling ring in as many months,PMN News,https://nationalpost.com/pmn/news-pmn/cyprus-police-say-they-have-dismantled-the-third-people-smuggling-ring-in-as-many-months
270,2023-10-24,William Watson: The hard-to-figure 'known unknowns' of a war in Gaza,Financial Post,https://nationalpost.comhttps://financialpost.com/opinion/hard-figure-known-unknowns-war-gaza
271,2023-10-24,Canadian doctors join ambulance crews in Israel to fill wartime gaps: 'I couldn't stay home',News,https://nationalpost.com/news/canadian-doctors-join-ambulance-crews-in-israel
272,2023-10-24,"FIRST READING: As Liberals fumble Hamas war, Conservative lead reaches meteoric new highs",NP Comment,https://nationalpost.com/opinion/first-reading-as-liberals-fumble-hamas-war-conservative-lead-reaches-meteoric-new-highs
273,2023-10-24,Tasha Kheiriddin: Re-election is more important to Trudeau than supporting Canadian Jews,NP Comment,https://nationalpost.com/opinion/re-election-more-important-to-trudeau-than-supporting-canadian-jews
274,2023-10-24,Mother of kidnapped Israeli woman recounts horror of last phone call,Israel & Middle East,https://nationalpost.com/news/world/israel-middle-east/mother-of-missing-israeli-woman-recounts-horror-of-last-phone-call
275,2023-10-24,"Israel-Hamas War updates: WHO, UN call for ceasefire before war spirals out of control",Israel & Middle East,https://nationalpost.com/news/world/israel-middle-east/israel-hamas-war-day-18
276,2023-10-24,Freed hostage reveals 'hell' of Hamas attack and how she was held in 'spiderweb of tunnels',World,https://nationalpost.com/news/world/yocheved-lifshitz-descrived-hostage-experience
277,2023-10-24,"Trudeau says his government supports 'pauses' in the Israel-Hamas war, after defence minister rejects ceasefire",Israel & Middle East,https://nationalpost.com/news/world/israel-middle-east/canadas-defence-minister-says-hamas-must-be-eliminated-dismisses-calls-for-a-ceasefire
278,2023-10-24,Joe Oliver: Trudeau's unprincipled disloyalty sowing the seeds of his own demise,NP Comment,https://nationalpost.com/opinion/trudeaus-unprincipled-disloyalty-sowing-the-seeds-of-his-own-demise
279,2023-10-24,Hostages and Hezbollah force Israel to rethink scope of Gaza invasion,Israel & Middle East,https://nationalpost.com/news/world/israel-middle-east/hostages-and-hezbollah-force-israel-to-rethink-scope-of-gaza-invasion
280,2023-10-25,Vivian Bercovici: Mother of Canadian murdered by Hamas given cold shoulder by Trudeau government,NP Comment,https://nationalpost.com/opinion/mother-of-canadian-murdered-by-hamas-given-cold-shoulder-by-trudeau-government
281,2023-10-25,"In the news today: Israel's bombardment in Gaza surges, reducing buildings to rubble",PMN Canada,https://nationalpost.com/pmn/news-pmn/canada-news-pmn/in-the-news-today-israels-bombardment-in-gaza-surges-reducing-buildings-to-rubble
282,2023-10-25,Joel Kotkin: Samuel Huntington was right — cultural and religious clashes are driving war today,NP Comment,https://nationalpost.com/opinion/samuel-huntington-was-right-cultural-and-religious-clashes-are-driving-war-today
283,2023-10-25,Halifax pair win $800 from WestJet for Christmas Day flight delays,Canada,https://nationalpost.com/news/canada/halifax-pair-win-800-from-westjet-for-christmas-day-flight-delays
284,2023-10-25,John Ivison: How Harper’s former ‘tough on crime’ adviser flipped to completely opposing prisons,NP Comment,https://nationalpost.com/opinion/ex-harper-advisor-rejects-tough-on-crime
285,2023-10-25,Ontario senator and former top public servant Ian Shugart dead at 66,Canada,https://nationalpost.com/news/canada/ontario-senator-and-former-top-public-servant-ian-shugart-dead-at-66
286,2023-10-25,"Chris Selley: It's up to voters to discipline Sarah Jama, not the Ontario legislature",NP Comment,https://nationalpost.com/opinion/chris-selley-up-to-voters-discipline-sarah-jama-not-ontario-legislature
287,2023-10-25,"J.D. Tuccille: Dead last in free speech rankings, Harvard gets reality check",NP Comment,https://nationalpost.com/opinion/dead-last-in-free-speech-rankings-harvard-gets-reality-check
288,2023-10-25,FIRST READING: The Indigenous rejection of massacres as 'decolonialization',NP Comment,https://nationalpost.com/opinion/first-reading-the-indigenous-rejection-of-massacres-as-decolonialization
289,2023-10-25,Air Canada accused of delaying British MP 'because his name is Mohammad',News,https://nationalpost.com/news/air-canada-accused-of-delaying-british-mp-because-his-name-is-mohammad
290,2023-10-25,Jamie Sarkonak: Federal government still hasn't managed to collect Laith Marouf's revoked grant,NP Comment,https://nationalpost.com/opinion/jamie-sarkonak-federal-government-still-hasnt-managed-to-collect-laith-maroufs-revoked-grant
291,2023-10-25,Sabrina Maddeaux: Sault Ste. Marie shooting a tragic reminder that justice needs reform,NP Comment,https://nationalpost.com/opinion/sault-ste-marie-shooting-tragic-reminder-justice-reform
292,2023-10-25,Israel-Hamas War updates: France proposes international coalition to fight Hamas; UN fails to agree on Israel,Israel & Middle East,https://nationalpost.com/news/world/israel-middle-east/https-nationalpost-com-news-world-israel-middle-east-israel-hamas-war-day-19
293,2023-10-25,Lawyers condemn antisemitic letter from Toronto law students in support of Hamas,Toronto,https://nationalpost.com/news/toronto/lawyers-toronto-metropolitan-university-israel-hamas
294,2023-10-25,Pro-ceasefire Liberal MPs see Trudeau's call for 'humanitarian pauses' as first step to ending Israel-Hamas hostilities,News,https://nationalpost.com/news/pro-ceasefire-liberal-mps-say-trudeaus-humanitarian-pauses-are-a-first-step-to-ending-israel-hamas-hostilities
295,2023-10-25,Terry Glavin: What we can learn from the obscene celebrations of Hamas brutality,NP Comment,https://nationalpost.com/opinion/terry-glavin-what-we-can-learn-from-the-obscene-celebrations-of-hamas-brutality
296,2023-10-25,How to defeat terrorism? The Jewish way is to leave them laughing,World,https://nationalpost.com/news/world/israelis-fight-terrorism-with-dark-humour
297,2023-10-26,Norfolk Southern investing in more automated inspection systems on its railroad to improve safety,PMN News,https://nationalpost.com/pmn/news-pmn/norfolk-southern-investing-in-automated-inspection-systems-on-its-railroad-to-improve-safety
298,2023-10-26,Norfolk Southern to end relocation aid right after one-year anniversary of its fiery Ohio derailment,PMN News,https://nationalpost.com/pmn/news-pmn/soil-removal-from-ohio-train-derailment-site-is-nearly-done-but-cleanup-isnt-over
299,2023-10-26,Jordan Peterson and Bjorn Lomborg: The world is not as gloomy as the media would have you believe,NP Comment,https://nationalpost.com/opinion/the-world-is-not-as-gloomy-as-the-media-would-have-you-believe
300,2023-10-26,Tasha Kheiriddin: Pro-Palestinian protesters ignore history — and their own causes pay the price,NP Comment,https://nationalpost.com/opinion/tasha-kheiriddin-pro-palestinian-protesters-ignore-history-and-their-own-causes-pays-the-price
301,2023-10-26,In the news today: Israeli troops launch brief ground raid into Gaza,PMN Canada,https://nationalpost.com/pmn/news-pmn/canada-news-pmn/in-the-news-today-israeli-troops-launch-brief-ground-raid-into-gaza
302,2023-10-26,Adam Pankratz: Have universities become dangerous to our nation?,NP Comment,https://nationalpost.com/opinion/have-universities-become-dangerous-to-our-nation
303,2023-10-26,Harry Rakowski: Those who rejoice in the massacre of Jews have no moral compass,NP Comment,https://nationalpost.com/opinion/those-who-rejoice-in-the-massacre-of-jews-have-no-moral-compass
304,2023-10-26,FIRST READING: The quiet Liberal plan to strike King Charles III from the oath of allegiance,NP Comment,https://nationalpost.com/opinion/first-reading-the-quiet-liberal-plan-to-strike-king-charles-iii-from-the-oath-of-allegiance
305,2023-10-26,Israel-Hamas War updates: Seventh Canadian killed in war,Israel & Middle East,https://nationalpost.com/news/world/israel-middle-east/israel-middle-east-israel-hamas-war-day-20
306,2023-10-26,Conservative heritage critic refuses to apologize for accusing CBC of being 'on the side of terrorists',Canadian Politics,https://nationalpost.com/news/politics/conservative-heritage-critic-refuses-to-apologize-for-accusing-cbc-of-being-on-the-side-of-terrorists
307,2023-10-26,Montreal man killed by Hamas in attack on Israel remembered as a hero at funeral,PMN Canada,https://nationalpost.com/pmn/news-pmn/canada-news-pmn/montreal-man-killed-by-hamas-in-attack-on-israel-remembered-as-a-hero-at-funeral
308,2023-10-26,Florida universities ordered to disband pro-Palestinian student group accused of backing Hamas,Israel & Middle East,https://nationalpost.com/news/world/israel-middle-east/florida-universities-ordered-to-disband-pro-palestinian-student-group-accused-of-backing-hamas
309,2023-10-26,Israeli soldiers have been training in the desert at this ghost town replica of Gaza City,Israel & Middle East,https://nationalpost.com/news/world/israel-middle-east/israeli-soldiers-have-been-training-in-the-desert-at-this-ghost-town-replica-of-gaza-city
310,2023-10-27,Harry Rakowski: Israel must save the hostages and extinguish Hamas,NP Comment,https://nationalpost.com/opinion/harry-rakowski-israel-must-save-the-hostages-and-extinguish-hamas
311,2023-10-27,$15 million class-action lawsuit filed against York University for antisemitic incidents,News,https://nationalpost.com/news/york-university-lawsuit-antisemtic-incidents
312,2023-10-27,"Israel Hamas War updates: 'We’re not drawing red lines for Israel,' White House says",Israel & Middle East,https://nationalpost.com/news/world/israel-middle-east/israel-hamas-war-day-21
313,2023-10-27,Robert E. Lee statue that prompted deadly protest in Virginia melted down and repurposed,News,https://nationalpost.com/news/robert-e-lee-statue-that-prompted-deadly-protest-in-virginia-melted-down
314,2023-10-27,U.S. fighter jets strike Iran-linked sites in Syria,World,https://nationalpost.com/news/world/u-s-fighter-jets-strike-iran-linked-sites-in-syria
315,2023-10-27,Western University Muslim chaplain dismissed for online comments,Canada,https://nationalpost.com/news/canada/western-university-muslim-chaplain-dismissed-for-online-comments
316,2023-10-27,Avi Benlolo: António Guterres blames the victims of Hamas's massacre,NP Comment,https://nationalpost.com/opinion/antonio-guterres-blames-the-victims-of-hamass-massacre
317,2023-10-27,Jack Mintz: The big difference between the Holocaust and the Hamas attack — Israel can fight back,Financial Post,https://nationalpost.comhttps://financialpost.com/opinion/difference-holocaust-hamas-attack-israel-fight-back
318,2023-10-27,"Michael Higgins: The virtueless, empty minds behind the vandalism of hostage posters",NP Comment,https://nationalpost.com/opinion/michael-higgins-the-virtueless-empty-minds-behind-the-vandalism-of-hostage-posters
319,2023-10-27,"Confirmed seventh Canadian killed in Israel-Hamas fighting, two others still missing",Israel & Middle East,https://nationalpost.com/news/world/israel-middle-east/confirmed-seventh-canadian-killed-in-israel-hamas-fighting-two-others-still-missing
320,2023-10-27,Pro-Palestinian car rally not planning to go through Jewish neighbourhoods: Toronto police,Toronto,https://nationalpost.com/news/toronto/ride-for-gaza
321,2023-10-27,In the news today: Israel strikes outskirts of Gaza City during second ground raid,PMN Canada,https://nationalpost.com/pmn/news-pmn/canada-news-pmn/in-the-news-today-israel-strikes-outskirts-of-gaza-city-during-second-ground-raid
322,2023-10-27,Elon Musk recommended X accounts of a teenager and a U.S. soldier,News,https://nationalpost.com/news/elon-musk-recommended-x-accounts-of-a-teenager-and-a-u-s-soldier
323,2023-10-27,UN rejects Canadian push to call out 'deliberate cruelty' of attacks by Hamas,Israel & Middle East,https://nationalpost.com/news/world/israel-middle-east/un-rejects-canadian-push-to-call-out-deliberate-cruelty-of-hamas-attacks
324,2023-10-28,Sabrina Maddeaux: Israel is the latest victim of TikTok's relentless propaganda,NP Comment,https://nationalpost.com/opinion/sabrina-maddeaux-israel-is-the-latest-victim-of-tiktoks-relentless-propaganda
325,2023-10-28,Netanyahu says war with Hamas has entered 'second stage' as Israeli ground forces enter Gaza,Israel & Middle East,https://nationalpost.com/news/world/israel-middle-east/israel-steps-up-attacks-in-advance-of-gaza-ground-offensive-leaving-territory-in-communications-blackout
326,2023-10-28,Iranian teen dies weeks after alleged assault by police for not wearing hijab,World,https://nationalpost.com/news/world/iranian-girl-dies-after-alleged-police-beating
327,2023-10-28,'Not my time': Mike Pence drops out of U.S. presidential race after campaign flounders,World,https://nationalpost.com/news/world/mike-pence-quits-2024-presidential-race
328,2023-10-29,Caregiver saves 95-year-old from Hamas terrorist with bribe,Israel & Middle East,https://nationalpost.com/news/world/israel-middle-east/filipino-caretaker-hamas-terrorist-israel-attack
329,2023-10-29,Israel-Hamas War updates: Thousands raid aid warehouses in Gaza for flour and necessities,Israel & Middle East,https://nationalpost.com/news/world/israel-middle-east/israel-hamas-war-day-23
330,2023-10-29,Weekend Posted: Some great stories you may have missed,News,https://nationalpost.com/news/weekend-posted-some-great-stories-you-may-have-missed-17
331,2023-10-29,NP View: Reaction to Hamas attack on campus shows universities are in desperate need of fixing,NP Comment,https://nationalpost.com/opinion/reaction-to-hamas-attack-on-campus-shows-canadian-universities-are-in-desperate-need-of-fixing
332,2023-10-29,Letters: 'Why do the CBC and the BBC pander to terrorists?',NP Comment,https://nationalpost.com/opinion/letters-why-do-the-cbc-and-the-bbc-pander-to-terrorists
333,2023-10-29,Antisemitic mob storms Russia's Dagestan airport looking for passengers on flight from Israel,Israel & Middle East,https://nationalpost.com/news/world/israel-middle-east/israel-russia-mob
334,2023-10-29,Son of Canadian hostage in Gaza worries his mother will die in Israel's ground invasion,Canada,https://nationalpost.com/news/canada/canadian-hostage-vivian-silver
335,2023-10-30,Ben Shapiro on why every Jew he knows is getting a gun: Full Comment podcast,NP Comment,https://nationalpost.com/opinion/ben-shapiro-on-why-every-jew-he-knows-is-getting-a-gun
336,2023-10-30,Now Israel hopes to destroy this underground city,Israel & Middle East,https://nationalpost.com/news/world/israel-middle-east/hamas-has-been-building-tunnels-for-years-now-israel-hopes-to-destroy-this-underground-city
337,2023-10-30,"Israel-Hamas War updates: Netanyahu says he won't resign, rejects calls for ceasefire",Israel & Middle East,https://nationalpost.com/news/world/israel-middle-east/israel-hamas-war-day-24
338,2023-10-30,FIRST READING: The Harper law that would have stopped all these pro-Hamas rallies,NP Comment,https://nationalpost.com/opinion/harper-law-that-would-have-stopped-all-these-pro-hamas-rallies
339,2023-10-30,Joel Kotkin: Jews are being abandoned by the left,NP Comment,https://nationalpost.com/opinion/jews-are-being-abandoned-by-the-left
340,2023-10-30,Danielle Kubes: Why doesn’t anyone care about Arab-on-Palestinian violence?,NP Comment,https://nationalpost.com/opinion/danielle-kubes-why-doesnt-anyone-care-about-arab-on-palestinian-violence
341,2023-10-30,Joly pleads for temporary pause in hostilities so humanitarian aid can reach Gaza,Israel & Middle East,https://nationalpost.com/news/world/israel-middle-east/joly-pleads-for-temporary-pause-in-hostilities-so-humanitarian-aid-can-reach-gaza
342,2023-10-30,Frank Furedi: The attempted pogrom at the Dagestan airport could happen anywhere,NP Comment,https://nationalpost.com/opinion/dagestan-pogrom-could-happen-anywhere
343,2023-10-30,"German-Israeli woman kidnapped by Hamas is dead, family says",Israel & Middle East,https://nationalpost.com/news/world/israel-middle-east/shani-louk-hamas
344,2023-10-30,Hamas has been building tunnels for years. Now Israel hopes to destroy this underground city,Israel & Middle East,https://nationalpost.com/news/world/israel-middle-east/hamas-has-been-building-tunnels-for-years-now-israel-hopes-to-destroy-this-underground-city
345,2023-10-30,Putin calls meeting after mob storms Dagestan airport in search of Jewish passengers,World,https://nationalpost.com/news/world/putin-dagestan-jews
346,2023-10-30,Israeli forces free IDF soldier held hostage in Gaza,Israel & Middle East,https://nationalpost.com/news/world/israel-middle-east/israeli-forces-free-idf-soldier-held-hostage-in-gaza
347,2023-10-30,Families of Hamas's hostages come to Ottawa seeking 'decisive action' to help free the victims,Canadian Politics,https://nationalpost.com/news/politics/families-of-hamas-hostages-seek-help-from-ottawa
348,2023-10-30,"'Crisis point': B.C. activists call for anti-crime strategy to deal with escalating violence, theft",Canada,https://nationalpost.com/news/canada/british-columbia-anti-crime-strategy
349,2023-10-30,"Cornell police investigating violent, antisemitic threats targeting university's Jewish community",World,https://nationalpost.com/news/world/cornell-investigating-violent-antisemitic-threats-jewish-community
350,2023-10-30,In the news today: Son of Canadian presumed hostage in Gaza fears military escalation,PMN Canada,https://nationalpost.com/pmn/news-pmn/canada-news-pmn/in-the-news-today-son-of-canadian-presumed-hostage-in-gaza-fears-military-escalation
351,2023-10-30,How Israel trains introverted ‘weasels’ to crack down on Hamas’s tunnels,News,https://nationalpost.com/news/israel-hamas-underground-tunnels
352,2023-10-31,John Ivison: Joly's 'pragmatic diplomacy' is just another Liberal foreign policy fantasy,NP Comment,https://nationalpost.com/opinion/john-ivison-joly-pragmatic-diplomacy-liberal-fantasy
353,2023-10-31,"For families of the dozens of children held hostage by Hamas, the wait is agonizing",Israel & Middle East,https://nationalpost.com/news/world/israel-middle-east/agony-for-families-of-hamas-child-hostages
354,2023-10-31,In the news today: Israeli ground forces in Gaza as Canada debates humanitarian pause,PMN Canada,https://nationalpost.com/pmn/news-pmn/canada-news-pmn/in-the-news-today-israeli-ground-forces-in-gaza-as-canada-debates-humanitarian-pause
355,2023-10-31,Neil Seeman: Why I won't be celebrating Halloween this year,NP Comment,https://nationalpost.com/opinion/why-i-wont-be-celebrating-halloween-this-year
356,2023-10-31,FIRST READING: These 'pro-Palestine' events remain littered with pro-terror extremism,NP Comment,https://nationalpost.com/opinion/pro-palestine-events-remain-littered-with-pro-terror-extremism
357,2023-10-31,Hamas leader who directed Oct. 7 massacre of Israeli civilians is dead: IDF,News,https://nationalpost.com/news/hamas-leader-who-directed-oct-7-massacre-of-israeli-civilians-dead
358,2023-10-31,Israel-Hamas War updates: Israel says large number of Hamas killed in refugee camp airstrikes,Israel & Middle East,https://nationalpost.com/news/world/israel-middle-east/israel-hamas-war-day-25
359,2023-10-31,Adam Zivo: Dagestani airport riot exposes Russia's strategic antisemitism,NP Comment,https://nationalpost.com/opinion/dagestani-airport-riot-exposes-russias-strategic-antisemitism
360,2023-10-31,B.C. commits to mandatory Holocaust education for Grade 10 students,Canada,https://nationalpost.com/news/canada/b-c-commits-to-mandatory-holocaust-education-for-grade-10-students
361,2023-10-31,China deletes Israel from online maps: report,News,https://nationalpost.com/news/china-deletes-israel-from-online-maps-report
362,2023-10-31,John Robson: Polite antisemitism on full display from international law 'experts' at uOttawa,NP Comment,https://nationalpost.com/opinion/polite-antisemitism-on-full-display-from-international-law-experts-at-uottawa
363,2023-11-01,"Joe Oliver: For the good of Canada, Justin Trudeau should go",NP Comment,https://nationalpost.com/opinion/joe-oliver-for-the-good-of-canada-justin-trudeau-should-go
364,2023-11-01,'Sobbing and shaking': Israeli parliament shown video of Hamas atrocities,Israel & Middle East,https://nationalpost.com/news/world/israel-middle-east/israeli-parliament-shown-hamas-atrocities
365,2023-11-01,"Rich Dlin: Even in Canada, it doesn't always feel safe to be Jewish",NP Comment,https://nationalpost.com/opinion/rich-dlin-even-in-canada-it-doesnt-always-feel-safe-to-be-jewish
366,2023-11-01,Steve Rosenberg: The objectivist case for Israel's right to self-defence,NP Comment,https://nationalpost.com/opinion/the-objectivist-case-for-israels-right-to-self-defence
367,2023-11-01,FIRST READING: Canadian academia doubles down on pro-terror sentiments,Canada,https://nationalpost.com/news/canada/canadian-academia-doubles-down-on-pro-terror-sentiments
368,2023-11-01,Senior Hamas official: We will repeat Oct. 7 until Israel is 'finished',News,https://nationalpost.com/news/senior-hamas-official-we-will-repeat-oct-7-until-israel-is-finished
369,2023-11-01,Michael Higgins: Mélanie Joly sees the tragedy of Gaza — but not the evil behind it,NP Comment,https://nationalpost.com/opinion/michael-higgins-melanie-joly-sees-the-tragedy-of-gaza-but-not-the-evil-behind-it
370,2023-11-01,Hamas's top leaders are worth billions. Here's how they continue to grow rich,Israel & Middle East,https://nationalpost.com/news/world/israel-middle-east/hamas-leaders-wealth
371,2023-11-01,"Passengers hid in the airport terminal from anti-Israel mob before being rescued, Israeli envoy to Russia says",World,https://nationalpost.com/news/world/anti-israel-mob-dagestan
372,2023-11-01,Israel-Hamas War updates: Biden backs humanitarian 'pause' in fighting to get 'prisoners' out,Israel & Middle East,https://nationalpost.com/news/world/israel-middle-east/israel-hamas-war-day-26
373,2023-11-01,"91-year-old 'grandfather of the kibbutz' survived the Holocaust, but was killed by Hamas",Israel & Middle East,https://nationalpost.com/news/world/israel-middle-east/91-year-old-grandfather-of-the-kibbutz-survived-the-holocaust-but-was-killed-by-hamas
374,2023-11-01,Terry Glavin: A dim hope amid the unfathomable horror of the Israel-Hamas war,NP Comment,https://nationalpost.com/opinion/a-dim-hope-amid-the-unfathomable-horror-of-the-israel-hamas-war
375,2023-11-01,In the news today: Vancouver man worries for family as Israeli airstrikes target Gaza,PMN Canada,https://nationalpost.com/pmn/news-pmn/canada-news-pmn/in-the-news-today-vancouver-man-worries-for-family-as-israeli-airstrikes-target-gaza
