,datetime,title,tag,url
503,2023-11-12,Greta Thunberg brushes off interruption at massive Dutch climate march days before election,PMN News,https://nationalpost.com/pmn/news-pmn/thousands-march-through-amsterdam-calling-for-climate-action-ahead-of-dutch-general-election
504,2023-11-12,Dutch election candidates make migration a key campaign issue in the crowded Netherlands,PMN News,https://nationalpost.com/pmn/news-pmn/dutch-election-candidates-make-migration-a-key-campaign-issue-in-the-crowded-netherlands
505,2023-11-12,Ottawa man arrested after allegedly inciting hate and antisemitism,Canada,https://nationalpost.com/news/canada/ottawa-man-arrested-after-allegedly-inciting-hate-and-antisemitism
506,2023-11-12,"Montreal Jewish school hit by gunshots for second time in three days, police say",PMN Canada,https://nationalpost.com/pmn/news-pmn/canada-news-pmn/montreal-jewish-school-hit-by-gunshots-for-second-time-in-three-days-police-say
507,2023-11-12,King Charles III leads a national memorial service honoring those who died serving the UK,PMN News,https://nationalpost.com/pmn/news-pmn/king-charles-iii-leads-a-national-memorial-service-honoring-those-who-died-serving-the-uk
508,2023-11-12,A fragile global economy is at stake as US and China seek to cool tensions at APEC summit,PMN News,https://nationalpost.com/pmn/news-pmn/a-fragile-global-economy-is-at-stake-as-us-and-china-seek-to-cool-tensions-at-apec-summit
509,2023-11-12,Raymond J. de Souza: Northern Gaza is becoming uninhabitable. Who will take these people in?,NP Comment,https://nationalpost.com/opinion/raymond-j-de-souza-northern-gaza-is-becoming-uninhabitable-who-will-take-these-people-in
510,2023-11-12,"Michael Mostyn: On Israel-Hamas war, Trudeau should follow his government's own advice on disinformation",NP Comment,https://nationalpost.com/opinion/on-israel-hamas-war-trudeau-should-follow-his-governments-own-advice-on-disinformation
511,2023-11-12,The unlikely Canadian who helped create the State of Israel,Canada,https://nationalpost.com/news/canada/the-unlikely-canadian-who-helped-create-the-state-of-israel
512,2023-11-12,Hundreds of Canadians trapped in Gaza still waiting to leave,Canada,https://nationalpost.com/news/canada/hundreds-of-canadians-trapped-in-gaza-still-waiting-to-leave
513,2023-11-12,Israel-Hamas War updates: U.S. official says Israel-Hamas hostage swap possible,Israel & Middle East,https://nationalpost.com/news/world/israel-middle-east/https-nationalpost-com-news-world-israel-middle-east-israel-hamas-war-day-37
514,2023-11-12,J.D. Tuccille: Democrats believe violence is the answer just as much as Trumpers do,NP Comment,https://nationalpost.com/opinion/j-d-tuccille-democrats-believe-violence-is-the-answer-just-as-much-as-trumpers-do
515,2023-11-12,Pro-Palestinian protest draws thousands in downtown Montreal,Canada,https://nationalpost.com/news/local-news/pro-palestinian-protest-draws-thousands-in-downtown-montreal/wcm/8377bbd8-20e1-4d31-9d56-3d677d58bd00
516,2023-11-13,In the news today: No Canadians on today's Rafah crossing list,PMN Canada,https://nationalpost.com/pmn/news-pmn/canada-news-pmn/in-the-news-today-no-canadians-on-todays-rafah-crossing-list
517,2023-11-13,A contest erupts in Uganda over the tainted legacy of late dictator Idi Amin,PMN News,https://nationalpost.com/pmn/news-pmn/a-contest-erupts-in-uganda-over-the-tainted-legacy-of-late-dictator-idi-amin
518,2023-11-13,80 people freed from Australian migrant centers since High Court outlawed indefinite detention,PMN News,https://nationalpost.com/pmn/news-pmn/80-people-freed-from-australian-migrant-centers-since-high-court-outlawed-indefinite-detention
519,2023-11-13,'They keep them in hell': An Israeli mom's anguish as Hamas holds her children hostage,News,https://nationalpost.com/news/hamas-children-hostages
520,2023-11-13,Michigan teen admits to planning violent attack on Jewish community,News,https://nationalpost.com/news/michigan-teen-social-media-jewish-violent-threats
521,2023-11-13,Canadian peace activist believed kidnapped by Hamas confirmed dead,News,https://nationalpost.com/news/canadian-israeli-vivian-silver-confirmed-dead
522,2023-11-13,Chris Selley: Universities could at least try countering antisemitism. They might even see results,NP Comment,https://nationalpost.com/opinion/universities-could-at-least-try-countering-antisemitism
523,2023-11-13,John Ivison: Ottawa’s new ‘pragmatic diplomacy’ policy misfires at the UN,NP Comment,https://nationalpost.com/opinion/canada-pragmatic-diplomacy-misfires-at-un
524,2023-11-13,"Montreal Jewish community won't let itself be terrorized, school spokesman says",PMN Canada,https://nationalpost.com/pmn/news-pmn/canada-news-pmn/montreal-jewish-community-wont-let-itself-be-terrorized-school-spokesman-says
525,2023-11-13,Interactive map visualizes tragic impact of Hamas attacks on Israel,News,https://nationalpost.com/news/interactive-map-hamas-attack-israel
526,2023-11-13,More Canadians flee Gaza as crossing into Egypt reopens,News,https://nationalpost.com/news/more-canadians-flee-gaza-as-crossing-into-egypt-reopens
527,2023-11-13,Rex Murphy: The undying hatred of Jews poisons the West,NP Comment,https://nationalpost.com/opinion/rex-murphy-the-undying-hatred-of-jews-poisons-the-west
528,2023-11-13,Supernova Sukkot Music Festival organizers vow to 'dance again' after terror attack,News,https://nationalpost.com/news/supernova-music-festival-attack
529,2023-11-13,Michael Higgins: Hillary Clinton shows Trudeau it's possible to be left-wing and not naive about Hamas,NP Comment,https://nationalpost.com/opinion/hillary-clinton-shows-trudeau-its-possible-to-be-left-wing-and-not-naive-about-hamas
530,2023-11-13,"Israeli president's son serving on Gaza front line, says first lady",News,https://nationalpost.com/news/israeli-presidents-son-gaza
531,2023-11-13,Israel-Hamas War updates: Hostages’ families rally in Jerusalem to demand United Nations secure their release,News,https://nationalpost.com/news/israel-middle-east-israel-hamas-war-day-38
532,2023-11-13,Greta Thunberg interrupted after pro-Palestinian message at climate protest,World,https://nationalpost.com/news/world/thunberg-pro-palestinian-climate-speech
533,2023-11-13,Hamas controls the narrative now: Full Comment podcast,NP Comment,https://nationalpost.com/opinion/hamas-controls-the-narrative-now
534,2023-11-13,Kfir Bibas: The youngest Hamas hostage is only 10 months old,Israel & Middle East,https://nationalpost.com/news/world/israel-middle-east/hamas-youngest-hostage
535,2023-11-13,FIRST READING: The Canadian lawyers and professors signing petitions to 'contextualize' Hamas terror,NP Comment,https://nationalpost.com/opinion/canadian-lawyers-professors-signing-petitions-to-contextualize-hamas-terror
536,2023-11-13,Hamas had detailed instructions on 'which (terror) commander should rape which (Israeli) soldiers': IDF,News,https://nationalpost.com/news/hamas-massacre
537,2023-11-14,A woman killed 31 years ago identified after relative recognizes distinctive tattoo,World,https://nationalpost.com/news/world/woman-with-the-flower-tattoo-identified
538,2023-11-14,Three people charged after Scotiabank Giller Prize gala interrupted by anti-Israel protesters,News,https://nationalpost.com/news/three-people-charged-after-scotiabank-giller-prize-gala-interrupted-by-protestors
539,2023-11-14,"A day after Britain's prime minister fired her, Suella Braverman accuses him of being a weak leader",PMN News,https://nationalpost.com/pmn/news-pmn/a-day-after-britains-prime-minister-fired-her-suella-braverman-accuses-him-of-being-a-weak-leader
540,2023-11-14,Montreal métro stations vandalized with posters related to Israel-Hamas war,Canada,https://nationalpost.com/news/local-news/metro-stations-vandalized-with-posters-related-to-israel-hamas-war/wcm/625c03e6-2e1c-4680-ac5a-6771291fc04e
541,2023-11-14,Hostage held by Hamas believed to have given birth in captivity: Israel,Israel & Middle East,https://nationalpost.com/news/world/israel-middle-east/hostage-held-by-hamas-believed-to-have-given-birth-in-captivity-israel
542,2023-11-14,Dispute involving student unions at York University reignites long-standing tensions,PMN Canada,https://nationalpost.com/pmn/news-pmn/canada-news-pmn/dispute-involving-student-unions-at-york-university-reignites-long-standing-tensions
543,2023-11-14,FIRST READING: NDP MP shares a Toronto dais with speaker echoing Hamas demands,NP Comment,https://nationalpost.com/opinion/ndp-mp-shares-toronto-dais-with-speaker-echoing-hamas-demands
544,2023-11-14,Derek H. Burney: Compounding international crises present Biden's biggest test,NP Comment,https://nationalpost.com/opinion/compounding-international-crises-present-bidens-biggest-test
545,2023-11-14,Rahim Mohamed: 'Anti-Zionism' is antisemitism in sheep's clothing,NP Comment,https://nationalpost.com/opinion/anti-zionism-is-antisemitism-in-sheeps-clothing
546,2023-11-14,In the news today: More Canadians hoping to leave Gaza as peace activist mourned,PMN Canada,https://nationalpost.com/pmn/news-pmn/canada-news-pmn/in-the-news-today-more-canadians-hoping-to-leave-gaza-as-peace-activist-mourned
547,2023-11-14,Jonathan Kay: Give me the Freedom Convoy over antisemitic campus lunatics any day,NP Comment,https://nationalpost.com/opinion/jonathan-kay-give-me-the-freedom-convoy-over-antisemitic-campus-lunatics-any-day
548,2023-11-14,Hostage seen in Hamas video confirmed dead by Israel,Israel & Middle East,https://nationalpost.com/news/world/israel-middle-east/hamas-hostage-dead
549,2023-11-14,"Kat Rosenfield: To Gen Z anti-Israel protesters, this is nothing but a party",NP Comment,https://nationalpost.com/opinion/kat-rosenfield-to-gen-z-anti-israel-protesters-this-is-nothing-but-a-party
550,2023-11-14,'The thought of yet another war drives me mad': The Canadian peace activist murdered by Hamas,NP Comment,https://nationalpost.com/opinion/vivian-silver-canadian-peace-activist-murdered-by-hamas
551,2023-11-14,Video captures off-duty Israeli soldier’s heroic final act on Oct. 7,Israel & Middle East,https://nationalpost.com/news/world/israel-middle-east/video-captures-off-duty-israeli-soldiers-heroic-final-act-on-oct-7
552,2023-11-14,Jesse Kline: Western media wilfully ignorant of Hamas using hospitals for war crimes,NP Comment,https://nationalpost.com/opinion/jesse-kline-western-media-wilfully-ignorant-of-hamas-using-hospitals-for-war-crimes
553,2023-11-15,"Sabrina Maddeaux: Hamas murdered Vivian Silver in cold blood, but Liberals would like to pretend otherwise",NP Comment,https://nationalpost.com/opinion/hamas-murdered-vivian-silver-in-cold-blood-but-liberals-would-like-to-pretend-otherwise
554,2023-11-15,"Ivison: An agitated Liberal caucus is driving Trudeau’s Israel stance, John Baird says",NP Comment,https://nationalpost.com/opinion/liberal-caucus-driving-trudeaus-israel-stance
555,2023-11-15,A short recap of the quickly deteriorating relationship between Trudeau and Netanyahu,Canadian Politics,https://nationalpost.com/news/politics/timeline-canada-trudeau-israel-netanyahu
556,2023-11-15,Concordia bans two from campus after investigation into Israel-Hamas altercation,Canada,https://nationalpost.com/news/local-news/concordia-bans-two-from-campus-after-investigation-into-altercation/wcm/f53d6001-725a-4cfb-8d13-c773c3e7ccaa
557,2023-11-15,Trudeau issues two minister mandate letters but won't be issuing any others,News,https://nationalpost.com/news/trudeau-minister-mandate-letters
558,2023-11-15,Greta Thunberg denies public order offense after arrest at London protest,World,https://nationalpost.com/news/world/greta-thunberg-denies-public-order-offense-after-she-was-arrested-at-a-london-protest
559,2023-11-15,100 Vancouver police sent after pro-Palestinian protesters surround Trudeau at restaurant,Canada,https://nationalpost.com/news/canada/vancouver-police-sent-after-protest-surrounds-justin-trudeau
560,2023-11-15,One in five Canadians surveyed want Trudeau to resign because they are 'just tired of him',Canada,https://nationalpost.com/news/canada/poll-trudeau-government
561,2023-11-15,"Israel-Hamas War updates: Israeli soldiers find Hamas weapons, command centre in Shifa Hospital",World,https://nationalpost.com/news/world/https-nationalpost-com-news-israel-middle-east-israel-hamas-war-day-40
562,2023-11-15,France issues arrest warrant for Syrian president over alleged war crimes,World,https://nationalpost.com/news/world/france-issues-arrest-warrants-syrian-president-war-crimes
563,2023-11-15,Letters: 'Vote Liberal and get carbon-taxed later',NP Comment,https://nationalpost.com/opinion/vote-liberal-and-get-carbon-taxed-later
564,2023-11-15,Israel-Hamas War updates: Israeli forces enter Gaza’s Shifa hospital for 'precise' action on Hamas,News,https://nationalpost.com/news/israel-middle-east-israel-hamas-war-day-39
565,2023-11-15,"Trudeau, Eby announce $1-billion battery plant in Maple Ridge, B.C.",Canada,https://nationalpost.com/news/canada/trudeau-eby-announce-1-billion-battery-plant-in-maple-ridge-b-c
566,2023-11-15,Gad Saad: Concordia University is unsafe for Jewish students and professors like me,NP Comment,https://nationalpost.com/opinion/gad-saad-concordia-university-is-unsafe-for-jewish-students-and-professors-like-me
567,2023-11-15,Netanyahu rebukes Trudeau on social media for criticizing Israel over civilian casualties,News,https://nationalpost.com/news/trudeau-rebuked-by-netanyahu-israel-hamas-comment
568,2023-11-15,Jesse Kline: Justin Trudeau just can't stop appeasing Israel's enemies,NP Comment,https://nationalpost.com/opinion/jesse-kline-justin-trudeau-just-cant-stop-appeasing-israels-enemies
569,2023-11-15,In the news today: No Canadians on Rafah crossing list as Israel raids Gaza hospital,PMN Canada,https://nationalpost.com/pmn/news-pmn/canada-news-pmn/in-the-news-today-no-canadians-on-rafah-crossing-list-as-israel-raids-gaza-hospital
570,2023-11-15,Singh: 'Netanyahu government is an extremist government — dangerous for the people of Israel’,Canada,https://nationalpost.com/news/national/ndps-jagmeet-singh-calls-israeli-pm-extremist-with-dangerous-policies/wcm/3662e288-561c-44bb-b32b-c29f3d3355c2
571,2023-11-16,Thousands of Starbucks workers go on a one-day strike on one of the chain's busiest days of year,PMN News,https://nationalpost.com/pmn/news-pmn/thousands-of-starbucks-workers-go-on-a-one-day-strike-one-of-busiest-days-of-year-for-the-chain
572,2023-11-16,"Biden, China's Xi agree to restart military dialogue, curb illicit fentanyl after four-hour meeting",World,https://nationalpost.com/news/world/biden-meets-with-chinas-xi-with-hopes-of-thawing-countries-strained-relationship
573,2023-11-16,Ex-Pink Floyd member Roger Waters refused at hotels in Argentina and Uruguay over antisemitism allegations,Israel & Middle East,https://nationalpost.com/news/world/israel-middle-east/roger-waters-antisemitism-allegations
574,2023-11-16,FIRST READING: Canada's endlessly fumbling response to Israel-Hamas,NP Comment,https://nationalpost.com/opinion/first-reading-canadas-endlessly-fumbling-response-to-israel-hamas
575,2023-11-16,"Christopher Dummitt: Oh look, the progressive left suddenly cares about free speech",NP Comment,https://nationalpost.com/opinion/christopher-dummitt-oh-look-the-progressive-left-suddenly-cares-about-free-speech
576,2023-11-16,Joel Kotkin: Trudeau's Green Jihad holding Canada back,NP Comment,https://nationalpost.com/opinion/joel-kotkin-trudeaus-green-jihad-holding-canada-back
577,2023-11-16,Protest calling for Israel-Hamas ceasefire blocks Montreal's Jacques Cartier Bridge,Canada,https://nationalpost.com/news/local-news/protest-calling-for-israel-hamas-ceasefire-blocks-jacques-cartier-bridge-thursday-morning/wcm/17e15270-d9f6-4f92-9119-60d7ab8e8329
578,2023-11-16,"Israel-Hamas War updates: Hamas agrees to tentative deal to free 50 hostages, report says",World,https://nationalpost.com/news/world/middle-east-israel-hamas-war-day-41
579,2023-11-16,'Silence our dissent': Doctor charged in vandalism at MP's office speaks out,Canada,https://nationalpost.com/news/local-news/doctor-charged-after-london-mps-office-vandalized-during-protest/wcm/16f53b50-0a92-407f-bbed-db365db43464
580,2023-11-16,"Jamie Sarkonak: Of course, Gen Z would turn to Jew-hating mass murdering Osama bin Laden",NP Comment,https://nationalpost.com/opinion/jamie-sarkonak-of-course-gen-z-would-turn-to-jew-hating-mass-murdering-osama-bin-laden
581,2023-11-16,Justin Trudeau called Israeli cabinet minister after his rebuke by Netanyahu,Israel & Middle East,https://nationalpost.com/news/world/israel-middle-east/trudeau-called-israeli-cabinet-minister-after-his-comments-that-lead-to-rebuke-from-netanyahu
582,2023-11-16,TikTok removes videos promoting Osama bin Laden's 'Letter to America' about 9/11,World,https://nationalpost.com/news/world/osama-bin-laden-letter-to-america
583,2023-11-16,In The News for today: No Canadians on Gaza list and Trudeau at APEC,PMN Canada,https://nationalpost.com/pmn/news-pmn/canada-news-pmn/in-the-news-for-today-no-canadians-on-gaza-list-and-trudeau-at-apec
584,2023-11-16,Amazon’s first Canadian wind farm project to be located in Alberta,Canada,https://nationalpost.com/news/canada/amazon-first-canadian-wind-farm-project-alberta
585,2023-11-16,"Hostage photos and videos found on laptops at Shifa Hospital, IDF says",World,https://nationalpost.com/news/world/shifa-hospital-laptop-photos-idf
586,2023-11-17,Thousands march through Athens to mark 50 years since a student uprising was crushed by dictatorship,PMN News,https://nationalpost.com/pmn/news-pmn/thousands-march-through-athens-to-mark-50-years-from-student-uprising-crushed-by-dictatorship
587,2023-11-17,Michael Higgins: Pandemic was exactly the wrong time to let health bureaucrats trample rights,NP Comment,https://nationalpost.com/opinion/michael-higgins-manning-report-justly-puts-individual-rights-above-health-bureaucrats
588,2023-11-17,Pro-Palestinian protesters disrupt Pierre Poilievre's Ontario rally,Canada,https://nationalpost.com/news/local-news/pro-palestinian-protestors-disrupt-pierre-poilievres-london-rally/wcm/90dc7bfa-2eda-4fb5-b30b-1116415d8ae3
589,2023-11-17,"Lawsuit accuses Concordia, student union of failing to address antisemitism on campus",PMN Canada,https://nationalpost.com/pmn/news-pmn/canada-news-pmn/lawsuit-accuses-concordia-student-union-of-failing-to-address-antisemitism-on-campus
590,2023-11-17,Jamie Sarkonak: Muslim charity under CRA microscope for ties to alleged Hamas front,NP Comment,https://nationalpost.com/opinion/jamie-sarkonak-the-cras-complex-allegations-of-systemic-islamophobia
591,2023-11-17,Body of second Israeli hostage killed by Hamas found near Shifa Hospital in Gaza: IDF,Israel & Middle East,https://nationalpost.com/news/world/israel-middle-east/body-of-second-israeli-hostage-killed-by-hamas-found-near-shifa-hospital-in-gaza-idf
592,2023-11-17,Israel-Hamas War updates: Funeral held for 19-year-old Hamas kidnap victim,World,https://nationalpost.com/news/world/israel-hamas-war-day-42
593,2023-11-17,"FIRST READING: Disgraced 'anti-racism' trainer returns to threaten Trudeau, pledge destruction of Canada",NP Comment,https://nationalpost.com/opinion/laith-marouf-anti-racism-trainer-returns-to-threaten-trudeau-pledge-destruction-of-canada
594,2023-11-17,Opinion: Where is Trudeau's moral clarity on Israel's war against Hamas?,NP Comment,https://nationalpost.com/opinion/opinion-hamas-massacres-funded-by-western-aid-money
595,2023-11-17,'Very grateful for things:' Woman who escaped Gaza appreciative of life in Canada,PMN Canada,https://nationalpost.com/pmn/news-pmn/canada-news-pmn/very-grateful-for-things-woman-who-escaped-gaza-appreciative-of-life-in-canada
596,2023-11-17,In The News for today: Alberta pension plan a no-brainer and APEC summit continues,PMN Canada,https://nationalpost.com/pmn/news-pmn/canada-news-pmn/in-the-news-for-today-alberta-pension-plan-a-no-brainer-and-apec-summit-continues
597,2023-11-17,Charge stayed against Calgary pro-Palestinian protester who chanted 'from the river to the sea',Canada,https://nationalpost.com/news/canada/from-the-river-to-the-sea-phrase
598,2023-11-17,California professor charged with involuntary manslaughter in death of Jewish man at rally,World,https://nationalpost.com/news/world/professor-charged-in-death-of-jewish-man
599,2023-11-17,Israeli fighter jets strike Gaza home of Hamas' billionaire leader Ismail Haniyeh,Israel & Middle East,https://nationalpost.com/news/world/israel-middle-east/israeli-fighter-jets-strike-gaza-home-of-hamas-billionaire-leader-ismail-haniyeh
600,2023-11-17,Limor Friedman: The radical calls for violence on Canadian streets,NP Comment,https://nationalpost.com/opinion/the-radical-calls-for-violence-on-canadian-streets
601,2023-11-18,"Family gathers for a farewell ceremony for Liel, a 12-year-old victim of Hamas",World,https://nationalpost.com/news/world/family-gathers-for-a-farewell-ceremony-for-liel-a-12-year-old-victim-of-hamas
602,2023-11-18,Anesthesiologist at Toronto's SickKids hospital investigated for anti-Israel comments,Canada,https://nationalpost.com/news/local-news/sickkids-anesthesiologist-investigated-for-anti-israel-comments/wcm/83c746c1-01b7-49ba-9bce-e80acb3305a0
603,2023-11-18,Musk criticized for 'abhorrent' boosting of antisemitic social media content on X,World,https://nationalpost.com/news/world/musk-criticized-for-abhorrent-boosting-of-antisemitic-social-media-content-on-x
604,2023-11-18,Opinion: Muslim leaders should've condemned Hamas instead of fomenting hate,NP Comment,https://nationalpost.com/opinion/muslim-leaders-shouldve-condemned-hamas-instead-of-fomenting-hate
605,2023-11-18,Conrad Black: New York Times writer pretends to be very scared of Israel's Netanyahu,NP Comment,https://nationalpost.com/opinion/conrad-black-new-york-times-writer-pretends-to-be-very-scared-of-israels-netanyahu
606,2023-11-18,"Some closure in London, Ont., after attack trial ends with murder convictions",PMN Canada,https://nationalpost.com/pmn/news-pmn/canada-news-pmn/some-closure-in-london-ont-after-attack-trial-ends-with-murder-convictions
607,2023-11-18,University of Alberta fires Sexual Assault Centre head who signed letter calling Hamas rape reports 'unverified accusation',Canada,https://nationalpost.com/news/local-news/university-of-alberta-fires-sexual-assault-centre-head-who-signed-letter-calling-hamas-rape-reports-unverified-accusation/wcm/1ba0e6c2-e6f1-45ad-bbf6-dadded59fe94
608,2023-11-18,Unclear when Canadians still in Gaza Strip can cross into Egypt,Canada,https://nationalpost.com/news/canada/unclear-when-canadians-still-in-gaza-strip-can-cross-into-egypt
609,2023-11-19,List of people cleared to leave Gaza Strip via Egypt includes 135 Canadians,Canada,https://nationalpost.com/news/canada/list-of-people-cleared-to-leave-gaza-strip-via-egypt-includes-135-canadians
610,2023-11-19,Israel-Hamas War updates: Israel says video shows tunnel under hospital,Israel & Middle East,https://nationalpost.com/news/world/israel-middle-east/israel-hamas-war-day-44
611,2023-11-19,"U.S., Israel and Hamas reach tentative deal to pause conflict and free dozens of hostages",World,https://nationalpost.com/news/world/u-s-israel-and-hamas-reach-tentative-deal-to-pause-conflict-and-free-dozens-of-hostages
612,2023-11-19,At least 30 premature babies evacuated from Gaza’s Shifa hospital,Canada,https://nationalpost.com/news/canada/at-least-30-premature-babies-evacuated-from-gazas-shifa-hospital
613,2023-11-19,J.D. Tuccille: Free speech lets us know who the antisemites are,NP Comment,https://nationalpost.com/opinion/j-d-tuccille-free-speech-lets-us-know-who-the-antisemites-are
614,2023-11-19,Raymond J. de Souza: Why secular progressives are prone to Jew hatred,NP Comment,https://nationalpost.com/opinion/raymond-j-de-souza-why-secular-progressives-are-prone-to-jew-hatred
615,2023-11-19,Letters: The U.S. is protecting its Jewish citizens. Too bad Canada isn't,NP Comment,https://nationalpost.com/opinion/letters-the-u-s-is-protecting-its-jewish-citizens-too-bad-canada-isnt
616,2023-11-19,Barbara Kay: How Quebec turned into a hotbed of antisemitism,NP Comment,https://nationalpost.com/opinion/barbara-kay-how-quebec-turned-into-a-hotbed-of-antisemitism
617,2023-11-20,"Pro-Palestinian protesters disrupt Saskatchewan legislature, call for ceasefire",News,https://nationalpost.com/news/pro-palestinian-protesters-disrupt-saskatchewan-legislature-call-for-ceasefire
618,2023-11-20,Is Canada's law against Holocaust denial actually working?,Canada,https://nationalpost.com/news/canada/is-canadas-law-against-holocaust-denial-actually-working
619,2023-11-20,Sabrina Maddeaux: Jewish rape victims don't matter to phoney feminists on the left,NP Comment,https://nationalpost.com/opinion/sabrina-maddeaux-jewish-rape-victims-dont-matter-to-phony-feminists-on-the-left
620,2023-11-20,IDF helps evacuate premature babies from Gaza to Egypt,Israel & Middle East,https://nationalpost.com/news/world/israel-middle-east/idf-helps-evacuate-premature-babies-from-gaza-to-egypt
621,2023-11-20,'Hamas-aligned' charities have received $260 million in donations: report,Israel & Middle East,https://nationalpost.com/news/world/israel-middle-east/hamas-charities-donations
622,2023-11-20,Don Braid: The pro-Hamas letter that got head of U of A Sexual Assault Centre fired,Canadian Politics,https://nationalpost.com/news/braid-pro-hamas-letter-u-of-a-sexual-assault-centre/wcm/5f9c07d4-0add-4e77-b2c7-26d8d05c7c26
623,2023-11-20,Rex Murphy: Trudeau would fail miserably if we faced half the crisis Israel has,NP Comment,https://nationalpost.com/opinion/rex-murphy-trudeau-would-fail-miserably-if-we-faced-half-the-crisis-israel-has
624,2023-11-20,Israel-Hamas War updates: Shell hits Gaza hospital as heavy fighting breaks out,Israel & Middle East,https://nationalpost.com/news/world/israel-middle-east/israel-hamas-war-updates-shell-hits-gaza-hospital-killing-12-as-heavy-fighting-breaks-out
